aliases,created,created_by_ref,description,external_references,goals,id,identity_class,indicator_types,is_family,kill_chain_phases,malware_types,modified,name,pattern,pattern_type,pattern_version,primary_motivation,sophistication,spec_version,threat_actor_types,tool_types,type,valid_from,x_capabilities,summary
,2026-01-20T20:17:07.779564Z,identity--5df7e8d9-d5c2-392a-f67d-511811817c4a,"A batch file is used as a loader script to automate the downloading and execution of a second-stage payload from GitHub, enabling the attacker to run malicious code without direct user interaction.",,,tool--b10018d2-ec93-f738-f427-b44bc89d659d,,,,"[{""kill_chain_name"": ""mitre-attack"", ""phase_name"": ""execution""}]",,2026-01-20T20:17:07.779564Z,Windows Batch Script (.BAT),,,,,,2.1,,"[""execution"", ""defense-evasion""]",tool,,,"The object contains information about a type of malicious tool known as a Windows Batch Script (.BAT). This script is used to automate the downloading and execution of a second-stage payload from GitHub, allowing an attacker to run malicious code without requiring direct user interaction. The primary goal of this tool is to enable attackers to carry out their nefarious activities with minimal human involvement.

The tool's characteristics include its classification as a defense-evasion technique, indicating that it is designed to evade detection by security systems. Additionally, the script can be used for execution purposes, suggesting that it may be employed in various malicious contexts. The presence of multiple kill chain phases, including ""execution,"" highlights the potential for widespread exploitation.

While specific details about malware types and sophistication levels are not provided, it is clear that this tool has been categorized as a threat based on its functionality. Furthermore, its association with GitHub suggests a level of organization and planning behind the malicious activities it enables. Overall, the object provides valuable insight into the nature and capabilities of Windows Batch Scripts (.BAT) used in malicious contexts."
,2026-01-20T20:17:07.779616Z,identity--5df7e8d9-d5c2-392a-f67d-511811817c4a,"A Windows shortcut file is abused to disguise the initial execution of malicious code by appearing as a legitimate PDF document, tricking users into launching the infection chain.",,,tool--33c6ae04-8eb6-9da8-fe1f-d1bb2722e94b,,,,"[{""kill_chain_name"": ""mitre-attack"", ""phase_name"": ""initial-access""}]",,2026-01-20T20:17:07.779616Z,Windows Shortcut (.LNK),,,,,,2.1,,"[""execution"", ""defense-evasion""]",tool,,,"The object contains information about a type of malware tool called Windows Shortcut (.LNK), which is used to disguise the initial execution of malicious code by tricking users into launching an infection chain. The tool is designed to appear as a legitimate PDF document, making it difficult for users to distinguish between legitimate and malicious files.

The primary purpose of this tool is to deceive users into executing malicious code, thereby allowing the malware to propagate further. It achieves this through the abuse of Windows shortcut files, which are commonly used to launch applications or open documents.

This tool is classified as a threat actor type not specified in the data provided, but it falls under the category of tools that are used for defense evasion tactics. The execution and defense-evasion capabilities of this tool make it a sophisticated malware vector.

The Windows Shortcut (.LNK) tool has the following characteristics: it uses the ""mitre-attack"" kill chain phase at its initial-access stage, indicating that it is designed to gain unauthorized access into the target system or network.

It belongs to the category of malware types not specified in the data provided. The external references to this tool are not available, and it has undergone no modifications.

This tool uses the ""execution"" and ""defense-evasion"" capabilities to carry out its malicious activities. It is a prime example of how malware tools can be used to deceive users and launch complex attacks on unsuspecting systems or networks."
,2026-01-20T20:17:07.779666Z,identity--5df7e8d9-d5c2-392a-f67d-511811817c4a,"GitHub is abused as a trusted cloud platform to host and deliver the second-stage payload, allowing attackers to blend malicious traffic with legitimate web activity and evade detection.",,,tool--bf215181-b514-0522-137b-3d4f6b73544a,,,,"[{""kill_chain_name"": ""mitre-attack"", ""phase_name"": ""resource-development""}]",,2026-01-20T20:17:07.779666Z,GitHub,,,,,,2.1,,"[""resource-development"", ""command-and-control""]",tool,,,"The object contains information about a tool called ""GitHub"", which is utilized by attackers to host and deliver the second-stage payload of malicious payloads. This allows attackers to blend their malicious traffic with legitimate web activity, thereby evading detection.

The primary motivation behind using GitHub as an abused cloud platform appears to be related to resource development for malicious purposes, specifically within the context of the MITRE Attack framework's ""Resource Development"" phase. 

The tool is categorized under ""command-and-control"" operations and is characterized by its ability to support resource development in conjunction with command-and-control functionalities.

In terms of threat actors, little information is available about the specific types targeted by this particular tool, as its sophistication level has not been documented or identified within this provided data.

Additionally, there are no known indicators or patterns associated with this tool, and it does not fall under any recognized family category."
,2026-01-20T20:17:07.779713Z,identity--5df7e8d9-d5c2-392a-f67d-511811817c4a,"The .NET WebClient class is used within PowerShell to programmatically download the malicious payload from GitHub, leveraging legitimate HTTP client functionality for covert delivery.",,,tool--3d97aa65-cd9a-2fa0-700a-db3758f358be,,,,"[{""kill_chain_name"": ""mitre-attack"", ""phase_name"": ""command-and-control""}]",,2026-01-20T20:17:07.779713Z,WebClient (System.Net.WebClient),,,,,,2.1,,"[""command-and-control"", ""network-capture""]",tool,,,"The object contains information about a .NET WebClient tool used for malicious purposes. The description provided explains how this tool is utilized within PowerShell to covertly download malware from GitHub, utilizing legitimate HTTP client functionality.

The purpose of the tool is not specified in terms of its primary motivation or sophistication level, indicating that it may be used for various malicious activities depending on the context in which it is employed. The tool types associated with this object are ""command-and-control"" and ""network-capture"", suggesting that it can facilitate communication between a client and server as well as capture network traffic.

It appears that the .NET WebClient class does not inherently possess any malicious functionality, but rather, it is being repurposed for covert delivery of malware. The presence of legitimate HTTP client functionality within this tool allows it to blend in with normal web browsing activities, making it harder to detect its true purpose.

Overall, the object provides insight into a specific piece of malware or a malicious tool that leverages legitimate .NET functionality to achieve its goals, highlighting the importance of monitoring and analyzing network traffic as well as PowerShell activity."
