created,created_by_ref,description,external_references,goals,id,identity_class,is_family,kill_chain_phases,malware_types,modified,name,primary_motivation,sophistication,spec_version,threat_actor_types,tool_types,type,x_capabilities,summary
2026-01-19T21:47:05.707631Z,identity--5df7e8d9-d5c2-392a-f67d-511811817c4a,"Legitimate Windows shortcut files are abused to simultaneously open the decoy document and execute malicious commands that copy, persist, and launch the malware payload.",,,tool--bb574d1f-4a2b-811e-2ca3-882adc77fe6a,,,"[{""kill_chain_name"": ""mitre-attack"", ""phase_name"": ""execution""}]",,2026-01-19T21:47:05.707631Z,Windows Shortcut (.LNK) files,,,2.1,,"[""execution"", ""defense-evasion""]",tool,,"The object contains information about a type of malicious attack on Windows shortcut files. Legitimate Windows shortcut files are being exploited to open decoy documents simultaneously while executing malicious commands that copy, persist, and launch the malware payload.

This attack involves deception, as legitimate shortcut files are being used to trick users into opening malware-laden documents. The attackers' goal is not explicitly stated in this data snippet, but it appears to be related to evading detection or creating a false sense of security by using familiar file types.

The attack vector seems to focus on the ""execution"" phase, where the malicious commands are executed without the user's knowledge or consent. This suggests that the attackers are trying to achieve a specific goal through this type of activity, possibly related to data exfiltration, lateral movement, or other forms of cyber espionage.

It is worth noting that the sophistication level and primary motivation behind this attack are not explicitly stated in this data snippet. However, it appears that the attack involves some level of social engineering or deception, as legitimate shortcut files are being used to trick users into engaging with malicious content.

Overall, the object provides a general overview of a type of attack on Windows shortcut files, but further analysis would be needed to determine the specific goals and motivations behind this activity."
2026-01-19T21:47:05.707682Z,identity--5df7e8d9-d5c2-392a-f67d-511811817c4a,"The Windows GetTickCount64 API is used by the malware for anti-analysis, checking for debugging or sandbox environments by measuring system uptime.",,,tool--959b7969-cc5d-4e84-860a-a7330b1254a6,,,"[{""kill_chain_name"": ""mitre-attack"", ""phase_name"": ""defense-evasion""}]",,2026-01-19T21:47:05.707682Z,GetTickCount64 API,,,2.1,,"[""defense-evasion"", ""information-gathering""]",tool,,"The object contains information about a tool used by malware, specifically the GetTickCount64 API. This tool is utilized for anti-analysis purposes, allowing the malware to detect if it's running in a debugging or sandbox environment by measuring system uptime. The tool falls under the category of defense-evasion and information-gathering tactics.

The primary function of this tool is to provide the malware with insights into its surroundings, enabling it to adapt and evade detection efforts. By leveraging the GetTickCount64 API, the malware can gather valuable information about its system environment, including the amount of time since the last reboot or system update.

In terms of its sophistication level, the use of this tool suggests that the malware is capable of sophisticated evasion techniques, making it challenging for security analysts to detect and analyze. However, without further context, it's difficult to determine the exact sophistication level of this particular tool.

The primary motivation behind using this tool appears to be defense-evasion, as it allows the malware to remain undetected while running its malicious payload. This is evident from its classification under the Mitre-Attack framework, which focuses on techniques used by attackers to evade detection and analysis."
2026-01-19T21:47:05.707729Z,identity--5df7e8d9-d5c2-392a-f67d-511811817c4a,"The GlobalMemoryStatusEx API is used by the malware to detect analysis environments by checking the amount of physical memory, evading detection in low-memory sandboxes.",,,tool--f61e486a-4618-5fc7-80c1-fc704290ed49,,,"[{""kill_chain_name"": ""mitre-attack"", ""phase_name"": ""defense-evasion""}]",,2026-01-19T21:47:05.707729Z,GlobalMemoryStatusEx API,,,2.1,,"[""defense-evasion"", ""information-gathering""]",tool,,"The object contains information about a malicious tool, specifically the GlobalMemoryStatusEx API, which is used by malware to detect analysis environments. The primary purpose of this tool is to evade detection in low-memory sandboxes by checking the amount of physical memory.

This tool falls under the category of defense-evasion tactics and information-gathering techniques. Its sophistication level is not specified, but it is classified as a threat actor type and a tool type that is associated with these activities.

The GlobalMemoryStatusEx API is used to detect analysis environments, which suggests that the malware is trying to avoid being detected by security measures or analysts. The fact that this tool is mentioned in conjunction with the Mitre Attack framework's ""defense-evasion"" phase further supports this interpretation.

It is worth noting that some information about the tool is missing, including its family classification and primary motivation, which might provide additional context about its intended use or goals. However, based on the available information, it can be concluded that the GlobalMemoryStatusEx API is a malicious tool used by malware to evade detection in low-memory environments."
2026-01-19T21:47:05.707811Z,identity--5df7e8d9-d5c2-392a-f67d-511811817c4a,"The IsDebuggerPresent API is leveraged by the malware to determine if it is being debugged, allowing it to evade analysis and detection.",,,tool--ce173db8-5211-3ba7-5e9d-1940255e9080,,,"[{""kill_chain_name"": ""mitre-attack"", ""phase_name"": ""defense-evasion""}]",,2026-01-19T21:47:05.707811Z,IsDebuggerPresent API,,,2.1,,"[""defense-evasion"", ""information-gathering""]",tool,,"The object contains information about a tool used by malware to determine if it is being debugged, thereby evading analysis and detection. This tool leverages the IsDebuggerPresent API to achieve its primary goal of defense evasion. The malware utilizes this technique to avoid detection and analysis, making it more difficult for security researchers to identify and understand the malicious activity.

The tool is categorized as a defense-evasion tactic, which falls under the broader category of kill chain phases. In this specific case, the tool's defense-evasion phase is associated with the MITRE-ATTACK framework. The tool's primary motivation is not explicitly stated, but its purpose is to help malware evade detection.

The tool types associated with this object are ""defense-evasion"" and ""information-gathering"", indicating that it can be used for both evasion techniques and gathering information about the system or environment it operates in. However, the specific threat actor types and sophistication level of the tool are not specified.

Overall, the IsDebuggerPresent API is a tool designed to aid malware in evading detection and analysis by exploiting vulnerabilities related to debugging and system instrumentation."
2026-01-19T21:47:05.707863Z,identity--5df7e8d9-d5c2-392a-f67d-511811817c4a,"The Sleep API is used by the malware to introduce delays, hindering automated analysis and sandbox detection by pausing execution for specified intervals.",,,tool--44f5ed64-7ec5-425e-c99c-64881ce48058,,,"[{""kill_chain_name"": ""mitre-attack"", ""phase_name"": ""defense-evasion""}]",,2026-01-19T21:47:05.707863Z,Sleep API,,,2.1,,"[""defense-evasion""]",tool,,"The object contains information about a specific type of malware tool, known as the Sleep API. The primary function of this tool is to introduce delays into a system's execution, which can hinder automated analysis and sandbox detection by pausing execution for specified intervals. This tactic is used by the malware to evade detection methods.

Additionally, the tool uses a technique called ""defense-evasion,"" which is classified under the kill chain phase ""mitre-attack"" as per the provided data. The use of this method suggests that the Sleep API is employed to deceive or mislead security systems, making it more difficult for them to detect and analyze the malware.

The tool's sophistication level and primary motivation are not specified in the provided information, leaving these aspects unclear. However, the fact that it uses a defense-evasion tactic implies that the malware developers aim to evade detection rather than cause direct harm.

In terms of classification, the Sleep API is categorized as a ""tool"" within the framework of threat actors and tool types. The tool's capabilities are primarily focused on defense evasion, making it useful for malware authors seeking to obscure their malicious activities from security systems."
2026-01-19T21:47:05.707908Z,identity--5df7e8d9-d5c2-392a-f67d-511811817c4a,"GitHub is abused as a cloud-based resource to host and deliver the initial malicious ISO file to victims, bypassing traditional security controls by leveraging a trusted platform.",,,tool--bf215181-b514-0522-137b-3d4f6b73544a,,,"[{""kill_chain_name"": ""mitre-attack"", ""phase_name"": ""resource-development""}]",,2026-01-19T21:47:05.707908Z,GitHub,,,2.1,,"[""resource-development"", ""initial-access""]",tool,,"The object contains information about a threat actor that exploits the GitHub platform to host and deliver malicious files to victims. This attack bypasses traditional security controls by leveraging the trustworthiness of the GitHub platform, making it a popular target for malicious activities.

The primary mechanism of this attack involves using GitHub as a cloud-based resource to distribute the initial malicious ISO file. This allows the attackers to evade detection by security systems that are typically designed to block or detect specific types of malware.

The tool used in this attack is associated with the MITRE ATT&CK framework, specifically the ""resource-development"" phase. This indicates that the primary goal of this threat actor is to develop resources and tools to facilitate their malicious activities.

Furthermore, the GitHub platform is used for initial access, allowing attackers to gain a foothold on the victim's system and establish further attacks from within."
