aliases,created,created_by_ref,description,external_references,goals,id,identity_class,indicator_types,is_family,kill_chain_phases,malware_types,modified,name,pattern,pattern_type,pattern_version,primary_motivation,sophistication,spec_version,threat_actor_types,tool_types,type,valid_from,x_capabilities,summary
,2026-01-20T20:16:52.221010Z,identity--5df7e8d9-d5c2-392a-f67d-511811817c4a,"The infection chain begins with a weaponized Windows shortcut (.LNK) file that is disguised as a PDF document, complete with a PDF icon and a filename resembling a legitimate judicial document. When the victim interacts with the LNK file, it stealthily launches PowerShell from the system directory, bypassing execution policy and running in hidden mode. This allows the malware to execute without visible windows or alerts, minimizing user suspicion. The masquerading technique is critical for deceiving users into executing the payload, as the shortcut appears to be a routine legal document relevant to their work.","[{""source_name"": ""mitre-attack"", ""url"": ""https://attack.mitre.org/techniques/T1036/004/"", ""external_id"": ""T1036.004""}]",,attack-pattern--c5c38290-e0c8-9aa2-bbf8-f4e81d29988e,,,,"[{""kill_chain_name"": ""mitre-attack"", ""phase_name"": ""defense-evasion""}]",,2026-01-20T20:16:52.221010Z,Malicious LNK File Masquerading as PDF,,,,,,2.1,,,attack-pattern,,,"The object contains a description of an attack pattern where the malware begins with a weaponized Windows shortcut (.LNK) file disguised as a PDF document. This deception technique is critical for deceiving users into executing the payload, as the shortcut appears to be a routine legal document relevant to their work.

When the victim interacts with the LNK file, it stealthily launches PowerShell from the system directory, bypassing execution policy and running in hidden mode. This allows the malware to execute without visible windows or alerts, minimizing user suspicion.

The masquerading technique used by this attack pattern is designed to deceive users into executing the payload, as the shortcut appears to be a legitimate PDF document relevant to their work. The use of PowerShell in hidden mode further complicates the detection and analysis of this attack pattern.

The attack pattern is classified under the MITRE-ATTACK framework, with a technique ID of T1036.004, which indicates that it falls under the category of defense evasion tactics."
,2026-01-20T20:16:52.221069Z,identity--5df7e8d9-d5c2-392a-f67d-511811817c4a,"Upon activation of the LNK file, PowerShell is executed with parameters that bypass the default execution policy and run in hidden mode. This enables the subsequent batch script to be executed without any visible command prompt or warning to the user. The use of '-ep bypass' and '-w hidden' ensures that security controls are circumvented and the execution remains stealthy, reducing the chances of detection by both the user and endpoint security solutions. This technique is used to download and execute further payloads from remote sources.","[{""source_name"": ""mitre-attack"", ""url"": ""https://attack.mitre.org/techniques/T1059/001/"", ""external_id"": ""T1059.001""}]",,attack-pattern--b1397215-1f4e-29f7-4790-bac6266668b8,,,,"[{""kill_chain_name"": ""mitre-attack"", ""phase_name"": ""execution""}]",,2026-01-20T20:16:52.221069Z,PowerShell Execution with Policy Bypass and Hidden Window,,,,,,2.1,,,attack-pattern,,,"The object contains information about an attack pattern related to the use of PowerShell to bypass security controls. Upon activation of a LNK file, PowerShell is executed in hidden mode, allowing subsequent batch scripts to be executed without any visible command prompt or warning to the user. This technique enables stealthy execution, reducing the chances of detection by both users and endpoint security solutions.

The attack pattern leverages parameters such as '-ep bypass' and '-w hidden', which bypass the default execution policy and hide the command prompt, respectively. This circumvents security controls, allowing further payloads to be downloaded and executed from remote sources.

The technique is documented in MITRE ATT&CK, where it corresponds to T1059/001. The attack pattern is classified under the ""mitre-attack"" kill chain phase named ""execution"". There is no specified malware or tool type associated with this attack pattern.

It appears that the primary motivation behind this attack pattern is not explicitly stated, but its use enables stealthy and covert execution of malicious payloads. The sophistication level of this attack pattern is also unclear, but it is evident that it leverages advanced techniques to evade detection."
,2026-01-20T20:16:52.221158Z,identity--5df7e8d9-d5c2-392a-f67d-511811817c4a,"The BAT-based loader script is responsible for establishing a connection to a GitHub-hosted URL and downloading the second-stage payload, which is a Rust-based Remote Access Trojan (RAT). The script uses PowerShell to create a WebClient object and assigns a legitimate-looking User-Agent string to blend in with normal browser traffic. The downloaded payload is saved as 'msedge_proxy.exe' within the Microsoft Edge user data directory, leveraging a trusted filename and location to appear legitimate. The script then executes the binary using Start-Process, facilitating stealthy deployment of the RAT.",,,attack-pattern--9630fda4-5a54-fa2a-9404-83d33f40674c,,,,"[{""kill_chain_name"": ""mitre-attack"", ""phase_name"": ""execution""}]",,2026-01-20T20:16:52.221158Z,Batch Script Loader Downloading Payload from GitHub,,,,,,2.1,,,attack-pattern,,,"The object contains information about a malicious attack pattern known as 'Batch Script Loader Downloading Payload from GitHub'. This attack pattern involves the use of a BAT-based loader script that establishes a connection to a GitHub-hosted URL and downloads a second-stage payload, which is a Rust-based Remote Access Trojan (RAT). The script uses PowerShell to create a WebClient object and assigns a legitimate-looking User-Agent string to blend in with normal browser traffic.

The downloaded payload is saved as 'msedge_proxy.exe' within the Microsoft Edge user data directory, leveraging a trusted filename and location to appear legitimate. The script then executes the binary using Start-Process, facilitating stealthy deployment of the RAT. This attack pattern appears to be designed for stealthy deployment of malware, making it difficult to detect.

The attack pattern is associated with the following goals, but no specific information is available in this data set. It also mentions certain kill chain phases, which indicate that this attack pattern may involve various stages of a typical cyberattack. However, no detailed information is provided about these phases or how they relate to each other.

Overall, this object contains general information about an attack pattern known as 'Batch Script Loader Downloading Payload from GitHub', which is used to download and execute a Remote Access Trojan (RAT) payload."
,2026-01-20T20:16:52.221206Z,identity--5df7e8d9-d5c2-392a-f67d-511811817c4a,"After downloading the second-stage payload, the malware saves it as 'msedge_proxy.exe' within the Microsoft Edge user data directory. This location and filename are chosen to mimic legitimate browser components, making the malicious executable less likely to be noticed or flagged by users or security software. By blending in with trusted application directories and filenames, the attackers effectively evade basic file-based detection and increase the persistence of their malware within the target environment.","[{""source_name"": ""mitre-attack"", ""url"": ""https://attack.mitre.org/techniques/T1036/005/"", ""external_id"": ""T1036.005""}]",,attack-pattern--20002fd8-2871-44e1-9c1f-0ac411650d0e,,,,"[{""kill_chain_name"": ""mitre-attack"", ""phase_name"": ""defense-evasion""}]",,2026-01-20T20:16:52.221206Z,Masquerading Payload as Legitimate Edge Proxy Executable,,,,,,2.1,,,attack-pattern,,,"The object contains information about a malware attack pattern known as ""Masquerading Payload as Legitimate Edge Proxy Executable"". This type of attack involves saving the second-stage payload within the Microsoft Edge user data directory, specifically as 'msedge_proxy.exe', in order to blend in with legitimate browser components. The attackers' goal is to evade basic file-based detection and increase the persistence of their malware within the target environment by mimicking trusted application directories and filenames.

The attack pattern is linked to a technique identified as T1036/005 by MITRE-Attack, which involves using a malicious executable to disguise itself as a legitimate browser component. This allows the attackers to evade security software and maintain control over the infected system for an extended period.

The primary motivation behind this attack pattern appears to be evading detection rather than financial gain or espionage, as there is no mention of any external references or motivations tied to specific threat actors. The sophistication level associated with this attack pattern is unknown, but it is clear that attackers have developed a clever method to disguise their malware as legitimate software.

The Malware Types field has not been populated, and the kill chain phase linked to this attack pattern is only ""defense-evasion"". This suggests that the primary goal of this attack pattern is to avoid detection by security measures rather than achieving specific financial or espionage goals."
,2026-01-20T20:16:52.221284Z,identity--5df7e8d9-d5c2-392a-f67d-511811817c4a,"The Rust-based RAT exhibits advanced anti-analysis behavior by spawning multiple command-line processes to query specific Windows registry keys. It checks for artifacts related to popular virtualization and sandbox platforms, including VMware, VirtualBox, and Hyper-V, by querying registry paths associated with their tools and services. This allows the malware to determine if it is running inside a virtualized or analysis environment, and potentially alter its behavior or terminate execution to avoid detection and analysis by security researchers.",,,attack-pattern--a086c489-0aa0-5e82-060e-c3e3ec7d5de8,,,,"[{""kill_chain_name"": ""mitre-attack"", ""phase_name"": ""defense-evasion""}]",,2026-01-20T20:16:52.221284Z,Environment and Virtualization Detection via Registry Queries,,,,,,2.1,,,attack-pattern,,,"The object contains a detailed description of an attack pattern identified by the name ""Environment and Virtualization Detection via Registry Queries."" This attack pattern is characterized by advanced anti-analysis behavior, where a Rust-based Rootkit Adversary Tool (RAT) spawns multiple command-line processes to query specific Windows registry keys. The goal of this behavior is to determine if it is running inside a virtualized or analysis environment, allowing the malware to potentially alter its behavior or terminate execution to avoid detection and analysis by security researchers.

To achieve this, the RAT checks for artifacts related to popular virtualization and sandbox platforms, including VMware, VirtualBox, and Hyper-V, by querying registry paths associated with their tools and services. This enables the malware to determine if it is running in a controlled environment, such as a sandboxed system or a virtual machine, which could compromise its operation.

The attack pattern falls under the category of defense-evasion tactics, specifically within the Mitre ATT&CK framework. The presence of this attack pattern suggests that the attacker is attempting to evade detection and analysis by security researchers, potentially by exploiting vulnerabilities in the operating system or application layer.

It's worth noting that the provided data does not contain information on the specific malware types, threat actors, tool types, sophistication levels, primary motivations, or any other relevant details. However, this attack pattern remains a critical component of the broader threat landscape, highlighting the importance of monitoring and analyzing registry queries for potential security risks."
,2026-01-20T20:16:52.221328Z,identity--5df7e8d9-d5c2-392a-f67d-511811817c4a,"To maintain long-term access and persistence on compromised systems, the malware creates scheduled tasks using the Windows 'schtasks' utility. The tasks are configured with parameters such as /TN (task name), /TR (task run), /DELAY0001:00, and optionally /RL HIGHEST to ensure elevated privileges. This allows the RAT to execute automatically at specified intervals or system events, ensuring continued operation even after system reboots or user logouts.","[{""source_name"": ""mitre-attack"", ""url"": ""https://attack.mitre.org/techniques/T1053/005/"", ""external_id"": ""T1053.005""}]",,attack-pattern--88dcfda0-30cb-6f83-a147-d80650806f81,,,,"[{""kill_chain_name"": ""mitre-attack"", ""phase_name"": ""persistence""}]",,2026-01-20T20:16:52.221328Z,Scheduled Task Creation for Persistence,,,,,,2.1,,,attack-pattern,,,"The object contains information about a specific attack pattern related to malware persistence. The attack pattern involves the creation of scheduled tasks using the Windows 'schtasks' utility, allowing the malware to execute automatically at specified intervals or system events. This ensures continued operation even after system reboots or user logouts.

The tasks created by the malware are configured with parameters such as /TN (task name), /TR (task run), /DELAY0001:00, and optionally /RL HIGHEST to ensure elevated privileges. The use of these parameters enables the RAT (Remote Access Trojan) to execute automatically at specified intervals or system events.

The attack pattern is associated with a specific technique number (T1053.005) from the MITRE-Attack framework, indicating its relevance to persistent malware operations. Furthermore, it falls under the phase of ""persistence"" in the kill chain.

There is no information available on the goals, indicators, family classification, sophistication level, or tool types associated with this attack pattern. However, it is classified as an attack pattern rather than a malware type, suggesting that it describes a broader category of malicious activities rather than a specific piece of malware itself."
,2026-01-20T20:16:52.221386Z,identity--5df7e8d9-d5c2-392a-f67d-511811817c4a,"The malware employs obfuscation techniques for its command and control (C2) communications, encoding commands and data in base64 format. This obfuscation is designed to evade network-based detection mechanisms and hinder analysis by security tools. Before execution, the malware decodes the base64-encoded commands, allowing it to interact with its C2 infrastructure in a manner that is less likely to be flagged by intrusion detection systems or network monitoring solutions.","[{""source_name"": ""mitre-attack"", ""url"": ""https://attack.mitre.org/techniques/T1027/"", ""external_id"": ""T1027""}]",,attack-pattern--29fd0255-a3bd-96ba-5d8d-6e485f1232e2,,,,"[{""kill_chain_name"": ""mitre-attack"", ""phase_name"": ""defense-evasion""}]",,2026-01-20T20:16:52.221386Z,Obfuscated Command and Control Communications,,,,,,2.1,,,attack-pattern,,,"The object contains information about a specific type of malware attack pattern known as ""Obfuscated Command and Control Communications."" This attack pattern employs obfuscation techniques to evade network-based detection mechanisms and hinder analysis by security tools. The malware encodes commands and data in base64 format, which is then decoded before execution to allow the malware to interact with its command and control (C2) infrastructure in a manner that is less likely to be flagged by intrusion detection systems or network monitoring solutions.

The attack pattern is associated with a specific threat actor type, as indicated by an external reference to Mitre-Attack technique T1027. This reference provides additional context about the attack pattern and its relationship to other threat actors and tactics.

The primary motivation behind this attack pattern appears to be evasion of detection and analysis by security tools, rather than any malicious intent to cause harm. The sophistication level of this attack pattern is unknown, but it is clear that it is a sophisticated tactic used by malware authors to evade detection.

Overall, the ""Obfuscated Command and Control Communications"" attack pattern is an example of a stealthy and evasive malware technique that can make it difficult for security systems to detect and analyze malicious activity."
,2026-01-20T20:16:52.221441Z,identity--5df7e8d9-d5c2-392a-f67d-511811817c4a,"To execute received instructions, the RAT decodes base64-encoded commands obtained from its command and control server. This deobfuscation step is necessary for the malware to interpret and act on the attacker’s directives, and also serves as an additional layer of defense evasion by making static analysis and detection more difficult. The technique demonstrates the malware’s capability to process obfuscated data and maintain covert communications with its operators.","[{""source_name"": ""mitre-attack"", ""url"": ""https://attack.mitre.org/techniques/T1140/"", ""external_id"": ""T1140""}]",,attack-pattern--336bc9d6-a078-fb3e-f571-ab3c7584ec1f,,,,"[{""kill_chain_name"": ""mitre-attack"", ""phase_name"": ""defense-evasion""}]",,2026-01-20T20:16:52.221441Z,Deobfuscation of C2 Commands Prior to Execution,,,,,,2.1,,,attack-pattern,,,"The object contains a description of an attack pattern related to the deobfuscation of command and control (C2) commands prior to execution. This technique is necessary for malware, specifically a Remote Access Trojan (RAT), to interpret and act on attacker's directives, while also serving as an additional layer of defense evasion by making static analysis and detection more difficult. The approach demonstrates the malware's capability to process obfuscated data and maintain covert communications with its operators.

The attack pattern is categorized under the MITRE-Attack framework, specifically technique T1140, which describes using legitimate tools to carry out malicious operations without arousing suspicion. This technique also serves as an indicator of the sophistication of the malware, making it more challenging for defenders to detect and analyze.

The primary motivation behind this technique appears to be evasion of detection, allowing the malware to operate undetected while still achieving its intended goals. The attack pattern can be used by attackers to make their malicious activities appear legitimate and increase the chances of successful exploitation.

Overall, the deobfuscation of C2 commands prior to execution is a critical component of modern malware tactics, enabling attackers to maintain operational security and evade detection by defenders."
"[""Rust-based Remote Access Trojan""]",2026-01-20T20:16:55.446473Z,identity--5df7e8d9-d5c2-392a-f67d-511811817c4a,"The campaign delivers a Rust-based Remote Access Trojan (RAT), referred to as 'Covert RAT', through a multi-stage spear-phishing attack targeting Argentina's judicial sector. The RAT is deployed via a weaponized LNK file and BAT script, enabling stealthy remote access and persistence on victim systems.",,,malware--9a397603-b70a-a185-c1e9-d252b6cc7ad9,,,True,,"[""remote-access-trojan"", ""trojan""]",2026-01-20T20:16:55.446473Z,Covert RAT,,,,,,2.1,,,malware,,"[""remote-access"", ""persistence"", ""anti-analysis"", ""command-and-control""]","The object contains a malicious software known as Covert RAT, which is a Rust-based Remote Access Trojan. It was deployed through a multi-stage spear-phishing attack targeting Argentina's judicial sector, aiming to gain stealthy remote access and persistence on victim systems. The malware is transmitted via a weaponized LNK file and BAT script.

Covert RAT operates by enabling the attackers to remotely access and control compromised systems, allowing them to execute malicious commands and maintain persistent infections. This Trojan has been classified as a remote-access-trojan and trojan malware.

The primary motivation behind Covert RAT appears to be malicious in nature, with no information available regarding its intended goals or motivations beyond providing stealthy remote access and persistence capabilities to attackers."
,2026-01-20T20:16:59.983889Z,identity--5df7e8d9-d5c2-392a-f67d-511811817c4a,"The article describes a sophisticated spear-phishing campaign targeting Argentina’s judicial sector, but does not explicitly attribute the activity to any known threat actor or group. The actor leverages advanced anti-analysis techniques, judicial-themed decoys, and a Rust-based Remote Access Trojan to achieve persistent access.",,"[""Establish persistent access within judicial-sector environments"", ""Exfiltrate sensitive legal and institutional data"", ""Exploit trust in judicial communications""]",threat-actor--ad921d60-4863-6625-8809-553a3db49a4a,,,,,,2026-01-20T20:16:59.983889Z,Unknown,,,,espionage,advanced,2.1,"[""unknown""]",,threat-actor,,,"The object contains information about a sophisticated threat actor that has been detected in an advanced spear-phishing campaign targeting Argentina's judicial sector. This campaign leverages various tactics, including anti-analysis techniques, judicial-themed decoys, and a Rust-based Remote Access Trojan, to achieve persistent access within the targeted environments.

The primary goals of this threat actor are to establish persistent access within judicial-sector environments, exfiltrate sensitive legal and institutional data, and exploit trust in judicial communications. The sophistication level of this threat actor is classified as advanced, indicating that it employs highly sophisticated techniques and tools to evade detection and achieve its objectives.

No specific known threat actor or group has been attributed to this activity, which suggests that the actor may be a new or unknown entity. However, it is worth noting that the campaign's tactics and techniques are reminiscent of other advanced threat actors, suggesting that it may be part of a larger ecosystem of similar threats.

The primary motivation behind this threat actor's activities appears to be espionage, with the goal of obtaining sensitive information related to the judicial sector. The use of judicial-themed decoys and anti-analysis techniques further suggests that the actor is attempting to blend in with the targeted environment and avoid detection.

Overall, this threat actor presents a significant concern for organizations within the judicial sector, highlighting the need for enhanced security measures to protect against advanced spear-phishing campaigns and persistent access threats."
,2026-01-20T20:17:07.779482Z,identity--5df7e8d9-d5c2-392a-f67d-511811817c4a,"PowerShell is used to stealthily execute a batch script from a Windows shortcut (.LNK) file, bypassing execution policy and running in hidden mode to avoid user detection. It is also used to download and execute a payload from a remote GitHub repository, facilitating multi-stage malware delivery.",,,tool--2f2d399f-0ea8-8448-59fe-5514b304733b,,,,"[{""kill_chain_name"": ""mitre-attack"", ""phase_name"": ""execution""}]",,2026-01-20T20:17:07.779482Z,PowerShell,,,,,,2.1,,"[""execution"", ""defense-evasion"", ""remote-access""]",tool,,,"The object contains information about a tool known as PowerShell. It is used to stealthily execute a batch script from a Windows shortcut file, allowing it to bypass execution policy and run in hidden mode, thus avoiding user detection. Additionally, PowerShell is utilized for downloading and executing a payload from a remote GitHub repository, which facilitates multi-stage malware delivery.

The primary motivation behind using PowerShell appears to be defense evasion, as it allows the tool to operate covertly by utilizing its stealthy nature to evade user detection. Furthermore, PowerShell can be used for execution and remote-access purposes, enabling attackers to remotely access systems without being detected.

It is essential to note that the specific motivations and capabilities of PowerShell may vary depending on the context in which it is used. However, in this case, the primary motivation seems to be defense evasion, while also providing execution and remote-access capabilities."
