address,blockchain,description,id,type,summary
BjVeAjPrSKFiingBn4vZvghsGj9KCE8AJVtbc9S8o8SC,solana,,blockchain-address--c94156e3-fb99-4dc2-a16e-a3cf10d7d766,blockchain-address,The object contains a detailed record of a blockchain address on the Solana network. The address is represented by a hexadecimal string 'BjVeAjPrSKFiingBn4vZvghsGj9KCE8AJVtbc9S8o8SC'. This address serves as a unique identifier for the blockchains associated with it.
0xA1decFB75C8C0CA28C10517ce56B710baf727d2e,binance-smart-chain,Smart contract used for initial eth_call to retrieve first-stage payload.,blockchain-address--003a06c8-8daa-45c6-80e7-fb969e4501db,blockchain-address,"The object contains a detailed description of a blockchain address on the Binance Smart Chain. This address is used for an initial eth_call to retrieve the first-stage payload. The specific characteristics of this address are as follows: it belongs to the 'binance-smart-chain' blockchain, and its address format is denoted by '0xA1decFB75C8C0CA28C10517ce56B710baf727d2e'."
0x46790e2Ac7F3CA5a7D1bfCe312d11E91d23383Ff,binance-smart-chain,Smart contract for delivering Windows-specific payloads.,blockchain-address--dfc4924d-1c30-4832-b045-53cdc7e1625c,blockchain-address,The object contains information about a specific blockchain address. The address itself is '0x46790e2Ac7F3CA5a7D1bfCe312d11E91d23383Ff' and it belongs to the Binance Smart Chain blockchain. This address corresponds to a smart contract that serves a Windows-specific payload delivery function.
0x68DcE15C1002a2689E19D33A3aE509DD1fEb11A5,binance-smart-chain,Smart contract for delivering macOS-specific payloads.,blockchain-address--bfa2730b-cfe8-4f71-81f9-dd960d5e8bbf,blockchain-address,"The object contains a blockchain address for the Binance Smart Chain, denoted by '0x68DcE15C1002a2689E19D33A3aE509DD1fEb11A5'. This address is associated with a specific smart contract. The purpose of this smart contract appears to be related to delivering macOS-specific payloads, as stated in the description provided."
0xf4a32588b50a59a82fbA148d436081A48d80832A,binance-smart-chain,"Gate contract for victim-ID access control, authorizes progression to next stage.",blockchain-address--299fc630-4849-4dad-b86f-2aa5720e8d73,blockchain-address,"The object contains information about a blockchain address. 

It belongs to the Binance Smart Chain blockchain. The specific address is 0xf4a32588b50a59a82fbA148d436081A48d80832A. This address serves as a gate contract for controlling access to victim IDs, allowing progression to the next stage in some process or system."
28PKnu7RzizxBzFPoLp69HLXp9bJL3JFtT2s5QzHsEA2,solana,,blockchain-address--f0b5ed50-2640-40cb-9335-6a4259ac2383,blockchain-address,The object contains information about a blockchain address. It is associated with the Solana blockchain. The address itself is represented by a unique identifier. No description or additional details are provided for this specific address.
