account_id,account_type,id,type,type_of_credential,summary
axisfiles,cloud,credential--395f2c23-a26d-49f3-a367-37e5091a73ef,credential,Azure Storage Account Shared Access Key,"The object contains a credential object for Azure Storage Account Shared Access Key. The account associated with this credential is named Axisfiles and belongs to the cloud type of account. The type of credential indicates that it is specifically designed for access to Azure Storage Account, providing shared access to key resources."
axiscontentfiles,cloud,credential--056844d2-1920-471c-b506-2af234aeda4d,credential,Azure Storage Account Shared Access Key,"The object contains a credential for Azure Storage Account Shared Access Key with the following details: The account is identified by the identifier axiscontentfiles. It belongs to a cloud-based account of type. This credential is associated with an access key that allows sharing of storage resources, and its unique identifier is credential--056844d2-1920-471c-b506-2af234aeda4d."
axisfiles,cloud,credential--72a5e052-b278-4458-9953-5a08baa9b054,credential,Azure Storage Account SAS Token,"The object contains a credential entry for an account type of cloud, specifically Azure Storage Account SAS Token. The credential belongs to an account identified by the unique identifier 'axisfiles'. This credential holds importance due to its connection to an account's ability to securely store and manage data in cloud storage services like Azure."
axiscontentfiles,cloud,credential--37f65519-3e07-4e99-b7ed-3f66d11d8bab,credential,Azure Storage Account SAS Token,The object contains a credential with the account_id 'axiscontentfiles' which is of type 'cloud'. The credential details include an Azure Storage Account SAS Token with a unique identifier.
axisapphelpfiles,cloud,credential--cd2b01bc-d379-4d54-9b72-30dd228106e3,credential,Azure Storage Account Connection String,"The object contains a credential object for an Azure Storage Account Connection String. The account type is cloud, indicating that this credential belongs to a cloud-based storage solution. The account ID associated with this credential is 'axisapphelpfiles'. This credential is specifically designed for managing connections to Azure Storage Accounts, allowing users to securely access and manage their storage resources."
