blockchain,id,labels,transaction_hash,type,summary
Ethereum,cryptocurrency-transaction--660ce1da-1b0d-45dc-8c8f-d9f506588de2,"[""INVISIBLEFERRET.JAVASCRIPT payload""]",0x86d1a21fd151e344ccc0778fd018c281db9d40b6ccd4bdd3588cb40fade1a33a,cryptocurrency-transaction,"The object contains a detailed record of a cryptocurrency transaction. The specific details include the type of blockchain associated with the transaction, which is Ethereum. This indicates that the transaction took place on the Ethereum network.

Further investigation reveals that this particular transaction is unique due to its payload. The labels provided for the transaction are ""INVISIBLEFERRET.JAVASCRIPT payload"", suggesting that the transaction contains some sort of JavaScript code or data related to a cryptocurrency wallet or exchange, perhaps used by the INVISIBLEFERRET entity.

The transaction itself has been assigned a hash value, which is ""0x86d1a21fd151e344ccc0778fd018c281db9d40b6ccd4bdd3588cb40fade1a33a"". This unique identifier allows for the tracking and verification of the transaction across the Ethereum network.

Ultimately, this record provides a snapshot of an individual cryptocurrency transaction on the Ethereum blockchain."
Ethereum,cryptocurrency-transaction--faa70556-1a07-46e1-960e-30ede817e9bf,"[""INVISIBLEFERRET.JAVASCRIPT split payload""]",0xc2da361c40279a4f2f84448791377652f2bf41f06d18f19941a96c720228cd0f,cryptocurrency-transaction,"The object contains a detailed record of a cryptocurrency transaction on the Ethereum blockchain. The transaction is identified by the hash value 0xc2da361c40279a4f2f84448791377652f2bf41f06d18f19941a96c720228cd0f, which serves as a unique identifier for this specific transaction."
Ethereum,cryptocurrency-transaction--c2b71ffc-5764-454a-8e84-288535cfb8b4,"[""INVISIBLEFERRET.JAVASCRIPT credential stealer payload""]",0xf9d432745ea15dbc00ff319417af3763f72fcf8a4debedbfceeef4246847ce41,cryptocurrency-transaction,The object contains a cryptocurrency transaction record for the Ethereum blockchain. The transaction type is designated as 'cryptocurrency-transaction'. A malicious credential stealer payload has been embedded within this transaction. This payload is identified by its label 'INVISIBLEFERRET.JAVASCRIPT'.
