summary,id,type
"The object contains information about a specific attack pattern. This attack pattern is related to the deobfuscation of commands received from an attacker's command and control server before execution. The malware RAT decodes base64-encoded commands, which serves as both an essential step for interpreting and acting on the attacker's directives and an additional layer of defense evasion that makes static analysis and detection more difficult.

The technique demonstrates the malware's capability to process obfuscated data and maintain covert communications with its operators. It also provides a level of sophistication in terms of the attack pattern, which is necessary for maintaining stealth and deception in cyber attacks.

It is essential to note that this attack pattern involves the processing of obfuscated data and is used primarily for evasion tactics. The primary motivation behind this attack pattern appears to be related to defense evasion techniques, making it more challenging to detect such malicious activities through traditional static analysis methods.",attack-pattern--336bc9d6-a078-fb3e-f571-ab3c7584ec1f,attack-pattern
"The object contains information about a malware campaign known as ""Covert RAT,"" which is described as a Rust-based Remote Access Trojan. This malware was delivered to victims through a multi-stage spear-phishing attack targeting Argentina's judicial sector, where it was deployed via a weaponized LNK file and BAT script. The RAT enables stealthy remote access and persistence on victim systems.

The campaign's primary goal appears to be the unauthorized remote access of sensitive information within the targeted sectors, although its full objectives may not have been fully disclosed. 

This malware falls under two categories: ""remote-access-trojan"" and ""trojan.""",malware--9a397603-b70a-a185-c1e9-d252b6cc7ad9,malware
"The object contains information about a sophisticated spear-phishing campaign targeting Argentina's judicial sector. The campaign utilizes advanced anti-analysis techniques, judicial-themed decoys, and a Rust-based Remote Access Trojan to achieve persistent access. The primary goals of the campaign include establishing persistent access within judicial-sector environments, exfiltrating sensitive legal and institutional data, and exploiting trust in judicial communications.

The sophistication level of this campaign is considered advanced, indicating that it employs sophisticated methods to evade detection. The specific tactics used by the attacker are not attributed to any known threat actor or group, leaving the attribution of the activity uncertain.

Overall, the information provided suggests a highly sophisticated and targeted attack against a critical sector, highlighting the need for increased vigilance and security measures to protect against such threats.",threat-actor--ad921d60-4863-6625-8809-553a3db49a4a,threat-actor
"The object contains information about a tool called PowerShell. This tool is used to stealthily execute a batch script from a Windows shortcut file, allowing it to bypass execution policy and run in hidden mode to avoid user detection. Additionally, PowerShell can be utilized to download and execute a payload from a remote GitHub repository, which facilitates multi-stage malware delivery.

PowerShell is categorized as a defense-evasion tool, meaning its primary purpose is to evade detection by security systems. The tool has various attack capabilities, including execution, where it executes malicious scripts, and remote-access, enabling attackers to access compromised systems remotely.

The tool's sophistication level and primary motivation are currently unknown, but its ability to bypass detection and execute payloads suggests a high level of complexity. However, the exact motivations behind using PowerShell as a tool remain unclear due to insufficient information.

In terms of threat actors, PowerShell is primarily associated with malware delivery, making it an important tool in the hands of malicious actors. Its ability to download and execute payloads from remote repositories makes it an effective means for multi-stage attacks.",tool--2f2d399f-0ea8-8448-59fe-5514b304733b,tool
"The object contains information about a Windows Batch Script (.BAT) tool. This tool is used to automate the downloading and execution of a second-stage payload from GitHub, allowing an attacker to run malicious code without direct user interaction. The script serves as a loader for the malware.

It belongs to the ""defense-evasion"" category in terms of its function within a tool-type framework, specifically categorized under tools meant for executing functions or attacks that evade detection.",tool--b10018d2-ec93-f738-f427-b44bc89d659d,tool
"The object contains information about a Windows shortcut file that is being abused by malicious actors. The primary method of attack involves disguising the initial execution of malicious code to appear as a legitimate PDF document, thereby tricking users into launching the infection chain.

This tactic falls under the category of defense-evasion techniques, specifically aimed at evading detection and deceiving the user into unwittingly executing malicious code.",tool--33c6ae04-8eb6-9da8-fe1f-d1bb2722e94b,tool
"The object contains information about a tool called GitHub. This tool is used by attackers to blend malicious traffic with legitimate web activity and evade detection. The primary motivation behind using GitHub for this purpose is not specified, but it is mentioned that GitHub is abused as a trusted cloud platform to host and deliver the second-stage payload.

GitHub falls under two categories of threat actors: tool-based attacks and command-and-control operations. It belongs to the ""resource-development"" and ""command-and-control"" tool types, which indicate its potential use in resource development and command and control tactics.

The sophistication level associated with GitHub is not mentioned in the data provided. However, it does contain a list of kill chain phases, including one phase named ""mitre-attack"" at ""resource-development"". This information suggests that GitHub can be used as part of an attack strategy that involves developing resources and using them to control other components.

It's worth noting that this object does not provide any details about the specific malware types associated with GitHub or its pattern type, which might indicate the method by which it blends malicious traffic with legitimate web activity. Overall, the data suggests that GitHub can be used as an attacker tool for malicious activities.",tool--bf215181-b514-0522-137b-3d4f6b73544a,tool
"The object contains information about a malicious tool used for covert delivery of malware through legitimate HTTP client functionality. This tool, referred to as WebClient, is part of the .NET framework in PowerShell and can be utilized by attackers to download malicious payloads from GitHub without raising suspicion.

According to the available data, the primary motivation behind using this tool appears to be for command-and-control operations. The attack pattern used involves leveraging the legitimate functionality of the HTTP client to deliver the malware. 

The attack pattern specifically falls under the category of ""mitre-attack"" and has a corresponding phase name of ""command-and-control."" This indicates that the primary goal is to establish communication with the attacker's server for further instructions or data exchange.

Furthermore, this tool can also be utilized in network-capture scenarios, suggesting its versatility in various types of cyber threats.",tool--3d97aa65-cd9a-2fa0-700a-db3758f358be,tool
