summary,id,type
"The object contains information about a ransomware threat actor known as Trigona. This group is identified for actively targeting exposed MS-SQL servers using weak credentials, employing a combination of custom malware, remote management tools, and brute-force techniques to gain access, deploy ransomware, and establish persistence.

Trigona's primary goal is to compromise MS-SQL servers, with secondary objectives including deploying ransomware, establishing remote access via tools such as AnyDesk and Teramind, creating persistent access accounts, and exfiltrating or monetizing system resources. The group uses an advanced level of sophistication in their tactics, employing custom malware and remote management tools.

Trigona is categorized as a criminal threat actor, with the primary motivation being financial gain from these malicious activities. Their methods are characterized as advanced, indicating a high level of complexity and technical expertise.",threat-actor--91cab5f4-544b-ad15-1b29-b7a4c0117368,threat-actor
"The object contains information about a threat tool called Cobalt Strike, which is used to deploy backdoors on compromised MS-SQL servers, allowing attackers to gain remote control and execute commands post-exploitation. This threat tool is categorized under command-and-control attacks, indicating its purpose is to facilitate communication between the attacker and the compromised server.

Cobalt Strike is identified as a malicious tool with no known aliases or external references. Its primary goal is unclear, but it falls under the sophistication level of unknown. The tool is classified as remote-access, exploitation, and command-and-control, suggesting it provides various functionalities for attackers to gain control over targeted systems.

The tool's capabilities are centered around command-and-control (C2) operations, where attackers can issue commands to compromised servers remotely. This suggests Cobalt Strike is designed to support post-exploitation activities, allowing attackers to execute malicious actions on vulnerable systems.

Unfortunately, the primary motivation behind using Cobalt Strike is not specified, leaving room for interpretation about its intended use case and potential threat actor affiliations.",tool--d10440fb-0e62-3537-56f5-aa7e3d3d443f,tool
"The object contains information about a malicious tool known as Meterpreter, which was installed as a backdoor on infected servers to provide attackers with interactive control over the compromised systems. This allowed further exploitation and lateral movement by the attackers. The tool is categorized under three main types of tools: remote-access, exploitation, and command-and-control. It is considered a sophisticated tool due to its capability to facilitate various malicious activities.

The Meterpreter tool was created on January 17, 2026, at 20:52:28 UTC, but no specific information about the identity of the creator is available. The tool's external references or family relationships are also unknown, as these fields are empty. 

Meterpreter has several kill chain phases associated with it, specifically a ""command-and-control"" phase within the Mitre-attack framework. This suggests that the tool is primarily used for initiating and managing malicious command-and-control operations.

Unfortunately, no information is available about the malware types, primary motivation, or threat actor types associated with Meterpreter, leaving these aspects of its nature unclear. The object also lacks information on sophistication levels and spec versions, making it difficult to assess its level of complexity and compatibility standards.

The tool's capabilities are outlined in terms of its x-capabilities, which seem to be missing from the metadata provided. However, based on the tool types associated with Meterpreter, it is likely that these capabilities encompass a range of remote-access, exploitation, and command-and-control functionalities.",tool--2b0ea882-cf9c-918a-9610-d71354fe5166,tool
"The object contains information about the tool ""AnyDesk"". AnyDesk is a legitimate remote desktop software that has been exploited to establish persistent remote access to compromised servers. This malicious use was achieved by installing the software silently, allowing for abused access to be established.

AnyDesk is classified as a tool belonging to the threat actor type of an unspecified entity, and it falls under two categories: ""remote-access"" and ""persistence"". The primary motivation behind this abuse is not explicitly stated; however, its sophistication level is unknown. 

The tool was created to exploit vulnerabilities and has undergone modifications, with the latest update occurring on the same date as its creation, 2026-01-17.",tool--d3ec00d1-2fc8-e67d-8022-63dc9e85639a,tool
"The object contains a tool used for maintaining unauthorized access to infected systems. This tool, identified as RustDesk, is described as being utilized as a legitimate remote desktop tool.

RustDesk has several characteristics that make it a persistence tool, which means it stays within the infected system for an extended period of time. It falls under the category of kill chain phases known as ""persistence"" and uses the MITRE-Attack framework to determine its tactics, techniques, and procedures (TTPs).

The primary purpose of RustDesk is not explicitly stated in the provided metadata, but it serves a dual function - both as a remote-access tool and a persistence tool. This suggests that the main intention behind creating or using this tool was likely for nefarious purposes.

The sophistication level associated with RustDesk is unknown, although its capabilities suggest it could be potentially complex in nature. There are no specific details provided regarding its primary motivation, but given its use as a remote desktop tool and persistence mechanism, it's likely that the intention behind its development or usage is malicious.

It's worth noting that this tool has been identified under various categories within the threat actor types, although the full range of these classifications is not explicitly stated in the metadata provided.",tool--70f4c86e-9585-6322-5d1d-807c6069374b,tool
"The object contains information about a malicious tool called Teramind, which is a remote monitoring and management (RMM) tool designed to provide attackers with ongoing surveillance and control over compromised hosts. The primary function of this tool is to enable attackers to remotely monitor and manage infected systems.

Teramind's capabilities include remote access, information gathering, and persistence, making it a versatile tool for threat actors. It has been classified under the MITRE Attack framework as a persistence phase, indicating that its main goal is to establish a long-term presence within an organization's network.

Despite being categorized as a malicious tool, Teramind does not have any specified malware types associated with it, suggesting that its primary function may be more focused on remote access and control rather than spreading malware. However, this information is currently unknown due to the lack of available data on the tool.

Overall, the object contains information about Teramind, a malicious tool designed for remote monitoring and management, with capabilities that align with persistence and long-term network presence.",tool--078e9bc0-8552-0b5a-7e45-7bb0763e6a67,tool
"The object contains information about a tool used to execute commands and download malicious payloads on compromised servers. The primary function of this tool is for execution, which allows it to carry out commands and actions on compromised systems. Additionally, the tool can be used for information gathering, as well as downloading malicious payloads.

The type of threats that can be posed by this tool are primarily related to its ability to execute and download malware, indicating a sophisticated level of attack complexity. However, due to its specific focus on execution and payload delivery, it is not associated with multiple threat actor types or families.

In terms of its capabilities, the tool falls under several categories, including execution, information gathering, and downloading malicious payloads. This suggests that the tool provides a range of functionalities for attackers to use in their campaigns.

The object's description highlights its potential to be used by sophisticated adversaries who seek to execute commands and deliver malware on compromised servers.",tool--2f2d399f-0ea8-8448-59fe-5514b304733b,tool
"The object contains a malicious tool known as BCP, which is used to extract and write malicious binaries stored in SQL tables onto the local system. This tool falls under the category of exploits and resource development tools, indicating its purpose of extracting and utilizing information from systems. The primary function of this tool is to be executed on a system, with secondary motivations related to exploiting resources and developing new capabilities.

The tool is classified as ""exploitation"" and ""resource-development"", which suggests that it is used for malicious purposes, such as accessing sensitive data or disrupting the normal functioning of a system. The sophistication level of this tool is not specified in the provided information, but given its primary function, it can be inferred that it requires some level of technical expertise to operate effectively.

The primary motivation behind using BCP is likely related to the extraction and utilization of malicious binaries stored in SQL tables, which could potentially allow for the compromise or disruption of a system. However, without further information on the threat actor types associated with this tool, it is difficult to determine the specific goals or motivations behind its use.

Overall, the object contains information about BCP, a malicious tool used for exploitation and resource development purposes, with an unspecified level of sophistication and motivation.",tool--22df3ece-0c89-cb42-339b-12b7537bcca9,tool
"The object contains information about a tool used for malicious purposes. The primary function of this tool is to download executables from remote servers onto an infected host. According to its description, the purpose of this tool is to facilitate the delivery of harmful malware.

This tool falls under two specific categories: ""download"" and ""information-gathering"". Its sophistication level is currently unknown. The tool has been created by a unique identity class, but further information about it is not available.

In terms of threats posed by this tool, there is an association with the Mitre-attack kill chain phase named ""execution"". This indicates that the execution phase is involved in its operation. However, no specific threat actor types or malware types are associated with this tool.

The object provides a detailed classification system for tools based on their characteristics and functionalities, allowing it to be categorized into different tool types.",tool--f6e57c9d-e709-e45f-eb0d-955351f53548,tool
