summary,id,type
"The object contains information about a threat intelligence report published by Seqrite Labs. The purpose of this report is not explicitly stated in the provided data, but it appears to be related to identifying potential security threats. 

Seqrite Labs has created this report which is classified as an identity, indicating that it refers to a specific organization rather than a type of malware or attack vector. However, no additional information about the organization itself can be obtained from the data.

Unfortunately, there is limited detail provided in the object regarding the goals and motivations behind the creation of the report. The primary motivation for creating this report seems to be related to STIXed by TI Mindmap HUB, but more specific details are not available.

The sophistication level associated with the report's threat actor or malware types is unknown due to the presence of 'nan' values in relevant fields. Therefore, it cannot be determined whether this identity represents a high-level threat.

This object provides information on potential patterns and types of threats that Seqrite Labs has identified as part of their intelligence efforts, but no specific details about these are available within the provided data.",identity--5df7e8d9-d5c2-392a-f67d-511811817c4a,identity
"The object contains information about a threat intelligence platform called TI Mindmap HUB. This AI-powered platform is designed to generate STIX bundles from Open-Source Intelligence (OSINT) sources, which suggests that it utilizes unclassified information gathered from various online sources to identify potential security threats.

The platform's primary function appears to be threat intelligence, as indicated by the presence of several fields related to this area. However, its exact goals and motivations are unclear, as specified by ""primary_motivation"" field being nan (null), which may indicate a lack of publicly available information or a need for further research.

Furthermore, TI Mindmap HUB seems to be primarily focused on identifying potential security threats at specific points in an attack chain, as indicated by the presence of several fields related to kill chain phases. However, the sophistication level and type of threat actors associated with this platform are unknown due to ""sophistication"" and ""threat_actor_types"" being nan (null).

Additionally, TI Mindmap HUB appears to be designed for specific types of indicators, such as malware or patterns, but the exact specifications and versions of these are unknown. The presence of fields related to pattern types, versions, and external references suggests that this platform is designed to process and analyze complex data, but more information would be needed to fully understand its capabilities.

Overall, TI Mindmap HUB appears to be a sophisticated threat intelligence platform designed for generating STIX bundles from OSINT sources. However, more research would be necessary to fully understand its goals, motivations, and capabilities.",identity--fbd192cb-0ab2-33e3-92cc-c2456bf8d439,identity
"The object contains a threat indicator describing an IP address, specifically 181.231.253.69, which is identified as a default fallback Command-and-Control server used by a Rust-based Remote Access Trojan (RAT) for persistent remote access and modular post-exploitation commands. The confidence level associated with this indicator is high, indicating its reliability. This IP address is classified under the category of malicious-activity and falls under the specific type of threat actor types and tool types not specified in the metadata. Additionally, the object contains a pattern that can be used to identify the IP address, which consists of an ipv4-addr value equal to '181.231.253.69'.",indicator--43f5a90b-819d-4698-af82-b6bad8727666,indicator
"The object contains a detailed description of an Indicator of Compromise, which is identified by its MD5 hash value, dc802b8c117a48520a01c98c6c9587b5. The indicator is classified as malicious activity and has been detected using a pattern that matches the MD5 hash of a weaponized Windows shortcut (.LNK) file used to initiate an infection chain and execute a BAT loader script via PowerShell. The confidence level associated with this indicator is high, indicating its reliability in detecting potential threats.

The notes section provides additional context about the detection method, stating that it involves analyzing the MD5 hash of the infected .LNK file, which was used as part of the initial infection chain to execute a malicious script. This suggests that the indicator has been verified using a specific pattern or technique, further supporting its reliability.

There is no information available on external references or further details regarding the threat actor types associated with this indicator. Additionally, there are no indications of family ties or sophistication levels, which could provide additional context about the nature and intent behind the detection.",indicator--c0306935-c395-45d2-b67f-32f3321fdeaa,indicator
"The object contains information about an Indicator of Compromise, which is a type of malicious activity that has been detected. The indicator is identified by the MD5 hash '45f2a677b3bf994a8f771e611bb29f4f', which is a file hash that can be used to identify specific files or archives. This hash corresponds to a ZIP archive delivered via spear-phishing email, containing an LNK file, a BAT loader, and a judicial-themed PDF decoy.

The confidence level of the indicator is high, indicating that it has been detected with a strong degree of certainty. The notes accompanying this indicator provide additional context, including details about the type of malware involved and how it was delivered to the victim via email. Specifically, the ZIP archive contained malicious files, while the PDF decoy was designed to appear legitimate.

The indicator is classified as being related to ""malicious-activity"" and has a specific pattern associated with it, which involves checking for a file hash equal to '45f2a677b3bf994a8f771e611bb29f4f' in files or archives. This pattern uses the STIX format and is version 2.1.

Unfortunately, some additional information about this indicator is missing, including details about its goals, sophistication level, primary motivation, tool types, threat actor types, and specific kill chain phases involved. However, based on the available data, it appears that this indicator is related to a type of malware attack involving spear-phishing emails with malicious attachments.",indicator--09e6fd72-b453-4498-97f1-b2049b5a2834,indicator
"The object contains information about a malicious indicator, specifically an MD5 hash of a file that is believed to be used in a malware attack. This hash has been identified as being associated with the second-stage payload of a remote-access Trojan (RAT) and has a confidence level of high. The notes indicate that this hash is related to a BAT file responsible for downloading and executing the RAT payload from a remote source.

The object's description provides additional context, highlighting its significance as an indicator of compromise in the realm of malicious activities. The specific type of threat actor associated with this malware is not explicitly stated, but it is categorized under ""malicious-activity"".",indicator--ecc88de6-a540-4eb8-a7d5-69f342daf62a,indicator
"The object contains a detailed description of a malicious indicator, specifically a MD5 hash of the msedge_proxy.exe file, which is a Rust-based Remote Access Trojan. The confidence level for this indicator is high, indicating its potential to be used in malicious activities. The hash itself, 976b6fce10456f0be6409ff724d7933b, has been identified as a MD5 signature of the msedge_proxy.exe file, suggesting that it may have been used in a cyber attack for persistent access, anti-analysis, and communication with command and control (C2) servers. The presence of this hash is considered an indicator of malicious activity.",indicator--a743ecc9-8fd4-4f8c-968a-3cf7143af9ea,indicator
"The object contains information about a specific indicator, which is categorized under the type of 'indicator'. This particular indicator is identified by its MD5 hash, specifically '233a9dbcfe4ae348c0c7f4c2defd1ea5', which was found in a PDF decoy document used for social engineering purposes. The confidence level associated with this indicator is high.

The purpose of this indicator appears to be related to malicious activity, as it falls under the category 'malicious-activity'. It can also be identified by its pattern, which matches a file hash using the MD5 algorithm and equals the provided hash value.

Further analysis indicates that this indicator does not fall into any specific family or is characterized by its sophistication level. The primary motivation behind its creation or detection is currently unknown due to missing information.

The object's external references, goals, kill chain phases, malware types, modified dates, names, and threat actor types are not applicable or available in the provided data set. Similarly, the tool types are missing from the metadata.",indicator--1eb51310-fd63-41ce-9837-453025b2c24e,indicator
"The object contains a detailed description of a threat indicator, specifically related to Windows registry keys, commonly used by Rootkits for persistence. The confidence level associated with this indicator is medium, indicating that it has some value but may not be conclusive. The description explains that the RAT (Remote Access Trojan) exploits the Run key values in the Windows registry to create randomized legitimate-looking names, which can lead to persistence on a compromised system.

Additionally, the threat actor types and tool types are not specified, leaving room for further investigation and analysis. This indicator is categorized under malicious-activity and has no known family affiliation, suggesting that it is unique or part of an unknown group. 

It's worth noting that there are no specific malware types associated with this indicator, but rather a broader category related to Windows registry keys. The object also lacks information on primary motivation, sophistication, and spec version, highlighting the need for further investigation into its purpose and potential impact.

Overall, the provided data offers a detailed glimpse into a threat indicator used in cybersecurity analysis, providing valuable insights into the tactics employed by Rootkits and RATs to maintain persistence on compromised systems.",indicator--0e1a0bc3-acd9-4478-a67e-decdbcb45207,indicator
"The object contains information about an Indicator of Compromise (IOC) related to malicious activity detected by a Rootkit (RAT). This IOC is specifically related to a Windows registry key located at HKLM\SOFTWARE\VMware, Inc.\VMware Tools. The confidence level associated with this IOC is medium. Additionally, the notes indicate that the RAT uses this registry key to detect VMware virtual environments and evade analysis.

The indicator type is classified as malicious-activity, suggesting that it relates to activities or behaviors that are considered malicious in nature. However, no specific information is provided regarding the goals of the IOC or the motivations behind its creation.

There are also references to external sources, but their relevance to this particular IOC is unknown due to the absence of information. Furthermore, there is no clear indication of which family of threats this IOC belongs to, as well as whether it has any specific connections to kill chains, malware types, or sophistication levels.

Lastly, the IOC lacks detailed information about its primary motivation and tool types used to create it, indicating that more context would be required to fully understand its significance.",indicator--b7d90829-e1d3-415a-9bbb-01c386c127b9,indicator
"The object contains information about a specific type of malicious activity related to VMware mouse service, which is part of the anti-analysis routines employed by the RAT. This indicator of compromise is detected in the Windows registry key under the 'HKLM\SYSTEM\ControlSet001\Services\vmmouse' path. The confidence level associated with this detection is medium, indicating a moderate level of certainty about its accuracy.

The pattern used to identify this malicious activity matches the format '[windows-registry-key:key = ""HKLM\\\\SYSTEM\\\\ControlSet001\\\\Services\\\\vmmouse""]', which suggests that it is specific to Windows registry keys. This pattern is classified as 'stix' and follows the STIX (Standardized Threat Indicator Expression) version 2.1 specification.

The primary motivation or purpose behind this detection is not explicitly stated, but its relation to anti-analysis routines by the RAT indicates that it might be used to identify potential security threats in systems compromised by malware.

Overall, this indicator provides valuable information about a specific type of malicious activity related to VMware mouse service and can be used as part of an organization's efforts to detect and mitigate security threats.",indicator--585ce6c1-9e0a-440b-b429-70fc76f7ff36,indicator
"The object contains a description of an indicator, specifically an indicator of Compromise related to the detection of VMware HGFS service for virtualization/sandbox evasion. This indicator is associated with a registry key located at HKLM\SYSTEM\ControlSet001\Services\vmhgfs and has been checked by a RAT (Remote Access Trojan) to identify potential malicious activity. The confidence level of this indicator is medium, indicating that while it is worth investigating further, its significance may not be immediately clear.",indicator--a6830aa9-ca4b-4e2e-b36f-56f9424ae843,indicator
"The object contains a description of an Indicator of Compromise, specifically related to the detection of VirtualBox guest additions by the RAT (Remote Access Trojan). The confidence level is medium. 

This indicator is detected through a registry key checked by the RAT in Windows. The name of this particular registry key points towards its relation with Oracle's VirtualBox Guest Additions. This suggests that the tool or actor using this technique aims to detect anti-analysis and sandbox evasion techniques employed by adversaries, who might be utilizing these virtual machine features for malicious purposes.

The object also contains information on pattern types and versions used in describing it. In particular, the object conforms to STIX (Structured Threat Intelligence Expression) patterns version 2.1, which is a widely accepted standard for threat intelligence exchange.",indicator--ced2df7b-0277-4145-834c-cca52ddb408f,indicator
"The object contains information about an indicator of compromise, specifically a registry key associated with the Wine emulation environment on Windows systems. The confidence level for this detection is medium, indicating that it is not considered highly reliable but still warrants attention. 

This specific registry key was checked by malware (RAT - Remote Access Trojan) to detect potential Wine emulation environments for defense evasion purposes. The notes accompanying this indicator provide insight into the purpose behind its creation and suggest a defensive measure against malicious activities.

The type of threat actor associated with this indicator is not specified, nor are there any details on the tool types or sophistication level involved. There is also no information provided on the malware types, goals, family classification, kill chain phases, external references, primary motivation, or specification version for this indicator.",indicator--af055e5b-3262-4fd4-ba50-184ed1f3a38a,indicator
"The object contains information about a spearphishing attack that specifically targets Argentina's judicial sector. The attackers deliver emails that are crafted to appear as legitimate judicial communications, complete with real Argentine federal court rulings referenced in the email and mimicking official formatting. These emails contain a ZIP archive that includes a malicious LNK shortcut file, a BAT loader script, and a highly authentic-looking judicial PDF decoy document.

The decoy document is designed to exploit trust in judicial communications and routine legal workflows, making recipients more likely to open the archive and execute the embedded malware. This technique demonstrates deliberate sector-specific targeting and leverages social engineering to achieve stealthy initial access. The attack utilizes this tactic to gain unauthorized access into the target's system.

The attack pattern falls under the category of ""mitre-attack"" and specifically targets the ""initial-access"" phase of the kill chain, indicating that it is used to gain initial access into the targeted system.",attack-pattern--50969ca5-1ce0-f880-e51e-b05982ca72e6,attack-pattern
"The object contains information about a malicious attack pattern known as ""Malicious LNK File Masquerading as PDF"". This attack involves disguising a Windows shortcut (.LNK) file as a legitimate PDF document, complete with a PDF icon and a filename resembling a judicial document. The malware is designed to launch PowerShell from the system directory when the victim interacts with the LNK file, allowing it to execute without visible windows or alerts.

The masquerading technique used in this attack is critical for deceiving users into executing the payload, as the shortcut appears to be a routine legal document relevant to their work. The malware uses stealthy methods to bypass execution policy and run in hidden mode, minimizing user suspicion.

According to external references, this attack pattern is associated with a specific technique identified by MITRE-Attack (T1036.004). It falls under the ""defense-evasion"" phase of the kill chain. The primary motivation behind this attack is not specified, but it is considered to be moderately sophisticated.

Overall, the Malicious LNK File Masquerading as PDF attack pattern involves using a combination of masquerading and stealthy techniques to deceive users into executing malicious code.",attack-pattern--c5c38290-e0c8-9aa2-bbf8-f4e81d29988e,attack-pattern
"The object contains a PowerShell execution technique that bypasses the default execution policy and runs in hidden mode to execute subsequent batch scripts without visible command prompt or warning to the user. This technique is used to download and execute further payloads from remote sources, making it difficult for both users and endpoint security solutions to detect.

When an LNK file is activated, PowerShell is executed with parameters that include '-ep bypass' and '-w hidden', which circumvent security controls and allow the execution of malicious scripts in stealth mode. This technique is categorized as a T1059.001 attack technique on the MITRE ATT&CK framework.

The primary goal of this technique is to enable the execution of further payloads from remote sources, making it a sophisticated attack pattern that requires careful planning and execution.",attack-pattern--b1397215-1f4e-29f7-4790-bac6266668b8,attack-pattern
"The object contains information about an attack pattern involving a batch script that downloads and executes a payload from GitHub. The script uses PowerShell to create a WebClient object, assigns a legitimate-looking User-Agent string to blend in with normal browser traffic, and downloads the second-stage payload, which is a Rust-based Remote Access Trojan (RAT). The downloaded payload is saved as 'msedge_proxy.exe' within the Microsoft Edge user data directory, leveraging a trusted filename and location to appear legitimate. 

The script then executes the binary using Start-Process, facilitating stealthy deployment of the RAT. This attack pattern falls under the category of 'mitre-attack', specifically in the execution phase. It does not belong to any specific malware type or family but rather involves the use of PowerShell and a WebClient object to download and execute malicious code.

The primary motivation behind this attack pattern is not explicitly stated, nor are its sophistication levels or specifications defined. However, it can be categorized as a sophisticated threat due to the use of stealthy techniques such as assigning a legitimate-looking User-Agent string and saving the payload with a trusted filename.",attack-pattern--9630fda4-5a54-fa2a-9404-83d33f40674c,attack-pattern
"The object contains a description of a malicious attack pattern known as ""Masquerading Payload as Legitimate Edge Proxy Executable."" This attack involves downloading the second-stage payload and saving it as 'msedge_proxy.exe' within the Microsoft Edge user data directory, in an attempt to mimic legitimate browser components. By doing so, the attackers make the malicious executable less likely to be noticed or flagged by users or security software.

The attackers choose this location and filename in order to blend in with trusted application directories and filenames, thereby evading basic file-based detection and increasing the persistence of their malware within the target environment. This tactic allows them to evade detection and remain hidden, making it more difficult for security measures to identify and remove the malicious code.

Additionally, the object provides a reference to the MITRE-attack technique T1036.005, which further supports this description of the attack pattern.",attack-pattern--20002fd8-2871-44e1-9c1f-0ac411650d0e,attack-pattern
"The object contains information about a specific attack pattern known as ""Environment and Virtualization Detection via Registry Queries"". This attack pattern is based on a Rust-based Rootkit Antivirus Tool (RAT) that utilizes advanced anti-analysis techniques to evade detection by security researchers. The RAT spawns multiple command-line processes to query specific Windows registry keys related to popular virtualization and sandbox platforms, including VMware, VirtualBox, and Hyper-V.

By querying these registry paths, the malware can determine if it is running inside a virtualized or analysis environment, allowing it to potentially alter its behavior or terminate execution to avoid detection. The attack pattern allows the RAT to identify artifacts associated with virtualization and sandbox platforms, which could indicate that the malware is running in an environment designed for security testing or analysis.

The attack pattern has been assigned a sophistication level, but no specific value is provided. It is classified as an ""attack-pattern"" and is part of the MITRE-Attack framework, specifically falling under the ""defense-evasion"" phase. No information is available regarding the family of malware associated with this attack pattern, its primary motivation, or any related tool types or threat actor types.",attack-pattern--a086c489-0aa0-5e82-060e-c3e3ec7d5de8,attack-pattern
"The object contains information about a malware technique used to maintain long-term access and persistence on compromised systems. To achieve this, the malware creates scheduled tasks using the Windows 'schtasks' utility, configuring them with parameters such as /TN (task name), /TR (task run), /DELAY0001:00, and optionally /RL HIGHEST to ensure elevated privileges.

This allows the Remote Access Trojan (RAT) to execute automatically at specified intervals or system events, ensuring continued operation even after system reboots or user logouts. The technique utilizes the Windows 'schtasks' utility to create tasks that can be scheduled to run at specific times or in response to certain events, thereby maintaining persistence on compromised systems.

The malware pattern is classified as a type of attack-pattern, and it has been identified by Mitre-Attack as Technique T1053.005. This technique is used for persistence and can be categorized under the kill-chain phase of 'persistence'.",attack-pattern--88dcfda0-30cb-6f83-a147-d80650806f81,attack-pattern
"The object contains information about an attack pattern attributed to the ""Obfuscated Command and Control Communications"" type. This attack pattern employs obfuscation techniques, specifically base64 encoding, to evade network-based detection mechanisms and hinder analysis by security tools. The malware uses this technique to interact with its command and control (C2) infrastructure in a way that is less likely to be flagged by intrusion detection systems or network monitoring solutions.

The attack pattern's primary motivation is not explicitly stated, but it is classified as an evasion tactic used to defend against intrusion detection systems. It also falls under the category of a ""defense-evasion"" technique, indicating that its main goal is to avoid being detected by security tools.

This attack pattern is associated with a sophistication level that has not been provided in the data, suggesting that it may be considered relatively complex or advanced. However, without further information on this aspect, the exact level of sophistication cannot be determined.

The object also contains references to external sources, including MITRE ATT&CK, which provides additional context about the attack pattern and its classification as a technique for T1027 (""Use Obfuscation"").",attack-pattern--29fd0255-a3bd-96ba-5d8d-6e485f1232e2,attack-pattern
