summary,id,type
"The object contains a threat intelligence report related to an organization named AhnLab Security Intelligence Center (ASEC). The description of this organization is provided by the AhnLab SEcurity intelligence Center, which is its publisher. According to the report, ASEC is responsible for STIXed content and has been mapped to TI Mindmap HUB. Unfortunately, no specific malware types, kill chain phases, or sophistication level associated with this organization can be identified due to the presence of 'nan' values in the relevant fields.",identity--c2e554c8-827c-3026-b5a9-b2ed4c3794e0,identity
"The object contains information about a threat intelligence platform called TI Mindmap HUB. The platform is described as an AI-powered tool that generates STIX bundles from OSINT sources, indicating its ability to analyze and process open-source intelligence data. Furthermore, the platform's primary function is to provide a centralized hub for mind mapping, suggesting its use in visualizing and organizing threat-related information.",identity--fbd192cb-0ab2-33e3-92cc-c2456bf8d439,identity
"The object contains an attack pattern related to brute force and credential stuffing on MS-SQL servers. The attackers target externally exposed database servers that have weak or default passwords, employing brute force and dictionary attacks to gain unauthorized access. They use automated tools to rapidly test large numbers of username and password combinations until access is achieved.

This initial access vector is a recurring theme in the observed incidents, as attackers leverage the fact that many database servers are configured with simple or guessable passwords. The campaign exploits this vulnerability, making the servers highly susceptible to automated credential attacks.

The attack pattern specifically targets MS-SQL servers, where the attackers use brute force and dictionary attacks to gain login access. Once login is successful, they proceed to execute further malicious activities.

The observed incidents highlight the importance of using strong and unique passwords for database servers to prevent such attacks. The use of automated tools by threat actors emphasizes the need for robust security measures to detect and respond to such threats in a timely manner.

The attack pattern is categorized under the MITRE Attack framework, with a technique ID of T1110.001, which is specifically related to the initial access phase. This indicates that the attack pattern falls within the initial access phase of the kill chain, where the primary goal is to gain initial access into the system or network.

Overall, this attack pattern highlights the need for robust security measures and regular password management practices to prevent brute force and credential stuffing attacks on MS-SQL servers.",attack-pattern--c3179ce8-b703-d23e-e235-0ae798fa0d3a,attack-pattern
"The object contains information about a specific attack pattern known as CLR Shell Execution for Payload Deployment. This technique involves gaining access to an MS-SQL server and utilizing the CLR (Common Language Runtime) Shell method to execute arbitrary commands and deploy additional payloads.

The attackers leverage SQL Server's ability to run .NET code, allowing them to execute system-level commands directly from the database context. This enables the installation of further malware, such as backdoors, privilege escalation tools, and remote access utilities. The consistent use of CLR Shell by the attackers suggests a preference for leveraging built-in server functionalities to maintain stealth and flexibility in their operations.

The external references provided highlight that this attack pattern has been documented by the MITRE Attack database, specifically under technique T1505/002. This information provides additional context about the attack pattern and its characteristics.

Overall, CLR Shell Execution for Payload Deployment is a sophisticated attack pattern that exploits the capabilities of SQL Server to execute arbitrary commands and deploy malicious payloads.",attack-pattern--3d58c97e-d8e3-46a3-b716-949415be5bfd,attack-pattern
"The object contains information about an attack pattern that leverages the Bulk Copy Program (BCP) utility to export malicious binaries stored in SQL tables to the local filesystem. Attackers inject or store malware payloads as binary objects in a database table and then use BCP commands to write these binaries to disk, specifying format files for proper extraction. This technique allows attackers to bypass traditional network-based delivery mechanisms and stage malware directly on the compromised server using legitimate administrative tools, thereby reducing the likelihood of detection by network security controls.

The attack pattern exploits vulnerabilities in the SQL tables and utilizes the BCP utility as a means to execute malicious operations without being detected by standard security measures. By injecting or storing malware payloads in database tables, attackers can avoid traditional network-based delivery mechanisms and instead use the compromised server's own tools to create local files containing the malicious content.

The attack pattern is characterized by its ability to bypass detection by network security controls, making it a sophisticated and evasive threat. The sophistication of this attack pattern lies in its use of legitimate administrative tools to stage malware on the compromised server, thereby avoiding traditional security measures designed to detect such activities.",attack-pattern--1b133d58-4f79-e08c-0006-ba87786f54cc,attack-pattern
"The object contains information about an attack pattern involving the use of legitimate command-line utilities like Curl, Bitsadmin, and PowerShell to download additional malicious payloads from remote servers. Following initial compromise, attackers utilize these tools to download malware components, including backdoors, miners, and remote access tools. This approach enables flexible and reliable delivery of malware while blending in with normal administrative activity and evading some endpoint protections.

The attack pattern utilizes specific URLs pointing to attacker-controlled infrastructure, which are invoked along with the downloaded files being saved to locations on the infected system. The use of these tools allows for a tailored delivery method that blends into legitimate network traffic.

According to external references, this attack pattern is classified under T1105 in the MITRE ATT&CK framework, indicating its alignment with specific techniques used by attackers to achieve their objectives.",attack-pattern--182cb842-ff8b-a8d7-aa43-448981d9c4f7,attack-pattern
"The object contains an attack pattern involving the installation of legitimate remote access software on compromised servers to establish persistent, interactive control. Attackers use widely recognized remote management tools like AnyDesk, RustDesk, and Teramind, which are deployed via silent installation commands and batch scripts often placed in system directories. This tactic allows attackers to maintain access even if other malware components are detected and removed.

The campaign also involves modifying registry keys to facilitate remote logon and creating new user accounts specifically for remote access, further entrenching their foothold on the compromised systems. The attack pattern is documented as part of a specific threat actor group, which has been assigned an external reference linking it to a particular Mitre-attack technique (T1219).",attack-pattern--1d74e0bd-50d8-89e8-14a9-2cfac7644e3d,attack-pattern
"The object contains information about an attack pattern known as ""Creation of New Local Users for RDP Access"". This technique involves using custom batch scripts to create new local user accounts, typically named 'Remote99', 'Ladmin', or 'erp2', which grant access to the system via Remote Desktop Protocol (RDP). The script also modifies system settings and registry keys to enable credential logon and facilitate remote access. 

The attacker uses this technique as part of a broader persistence and privilege escalation strategy, ensuring continued access and control over the compromised system even if the original account is disabled or removed. This attack pattern is documented in the MITRE-Attack framework, where it is classified under technique T1136/001.

In essence, the ""Creation of New Local Users for RDP Access"" attack pattern utilizes custom batch scripts to establish new privileged accounts, which provides a lasting means of exploitation even after the initial compromise has been addressed.",attack-pattern--4ad80e6b-7119-947c-a7df-86a53ec04113,attack-pattern
"The object contains information about an attack pattern involving the deployment of custom Rust-based scanner malware on infected servers. This malware is used to collect system information, scan for additional targets, gather IP and geolocation data via 'ip-api.com', and report this information to a command and control (C&C) server. The malware also performs targeted scans for RDP and MS-SQL services within the network, enabling lateral movement and identification of further vulnerable systems.

The attackers' use of custom-built scanners indicates a tailored approach to internal reconnaissance and expansion within compromised environments. This attack pattern is classified as part of the MITRE-attack technique T1046, which involves using external tools or resources, in this case, 'ip-api.com', to gather information about the target environment.

The malware's primary function is to enable lateral movement and identify further vulnerable systems within the network, making it a sophisticated attack pattern. The sophistication level of this attack pattern is not specified, but its use of custom-built scanners suggests a high level of expertise and effort on the part of the attackers.

Overall, this attack pattern highlights the potential for attackers to use custom-built malware to gather information about an organization's networks and systems, and to identify further vulnerabilities that can be exploited.",attack-pattern--507c5097-afe2-ccc0-e3f3-9421f6f3646d,attack-pattern
"The object contains a threat intelligence pattern related to the installation of proxyware and cryptocurrency mining software on compromised servers. This technique is used by attackers to monetize the resources of the infected server, generating revenue by sharing its available internet bandwidth with external parties or exploiting CPU resources to mine cryptocurrency.

Proxyware allows the attacker to harness the server's internet connectivity to generate revenue, while CoinMiner exploits the server's CPU resources to mine cryptocurrency. This monetization technique is often deployed alongside other malware, maximizing the financial gain from each compromised asset and running covertly in the background to avoid detection.

The attack pattern is characterized by its sophistication level, which is currently unknown, as well as its primary motivation, which remains unspecified. The threat actor type and tool types associated with this attack pattern are also unknown. Additionally, the malware types used in this attack pattern have not been identified.

This attack pattern fits into the kill chain phases, specifically the impact phase, and has been linked to a specific Mitre-attack technique (T1496). It is considered an attack pattern rather than a family of attacks, as its sophistication level and primary motivation are currently unknown.",attack-pattern--c78bd3f3-4ff8-25bd-465c-9b60ec9be72f,attack-pattern
"The object contains information about an attack pattern related to the use of a custom-built tool named StressTester. Attackers utilize this tool, written in Go programming language, to assess the performance and vulnerability of targeted services. The StressTester is capable of sending GET and POST requests, as well as executing SQL injection attempts against MS-SQL servers.

This allows attackers to test the robustness of services, identify exploitable injection points, and potentially disrupt normal operations. Notably, the deployment of StressTester prior to launching brute force or injection attacks indicates a deliberate, reconnaissance-driven approach to exploitation. The use of this custom tool suggests that the attacker is interested in evaluating the service's availability and potential vulnerabilities.

The attack pattern falls under the Mitre-Attack kill chain phases and specifically targets the discovery phase. It does not provide further details on the specific tactics, techniques, or procedures (TTPs) used by attackers. Additionally, there is no information available on the malware types, primary motivation, sophistication level, threat actor types, tool types, or external references associated with this attack pattern.

Overall, the object provides valuable insights into the tactics and techniques used by attackers to evaluate service availability and identify potential vulnerabilities using custom-built tools like StressTester.",attack-pattern--2a9aa73f-8dab-b578-9757-8d1a7310d4f7,attack-pattern
"The object contains information about the CLR Shell malware, a type of backdoor Trojan that is used by attackers to execute arbitrary commands on compromised MS-SQL servers. The malware enables further payload delivery and system control, allowing attackers to maintain control over the compromised server.

According to the data, the CLR Shell is designed for remote-access, command-and-control, and lateral-movement capabilities, making it a versatile tool for attackers. It falls under the category of backdoor Trojans, which are malicious software that allows unauthorized access to a computer or network.

The malware's primary purpose is not explicitly stated in the data, but its use case suggests that it is designed for sophisticated attacks involving lateral movement and command-and-control capabilities. The object also provides information about the malware's sophistication level, which is currently unknown.

It is worth noting that the CLR Shell is part of a larger family of malware, as indicated by the ""is_family"" field in the data. This suggests that similar malware variants may exist, and attackers may use these variants to achieve their malicious goals.",malware--ce06ca58-a8b1-227a-3fad-65480f80b30c,malware
"The object contains information about a type of malware known as ""Potato"". This malware is used for privilege escalation on Windows systems, allowing attackers to gain higher-level access after the initial compromise. It falls under two categories: privilege-escalation and Trojan.

According to its description, Potato-type malware is employed by attackers to acquire elevated privileges on compromised systems. Its primary function is to enable the malicious actor to move beyond their initial point of entry, thereby gaining more control over the system.

The object also mentions that Potato malware has capabilities for both privilege-escalation and persistence. This means that once the malware gains access to a system, it can continue to operate and persist even if other parts of its infrastructure are compromised or removed. 

Furthermore, the type of threat represented by this malware is classified as family, indicating that there may be multiple variants of Potato malware with similar characteristics.",malware--8ee20279-8391-5ec7-8acc-45027d874316,malware
"The object contains information about a type of malware known as CoinMiner, which is deployed to hijack system resources for unauthorized cryptocurrency mining. This malicious software exploits compromised servers for financial gain.

CoinMiner is classified as a Trojan malware and is considered to be part of a family of similar threats. Its primary motivation and sophistication are currently unknown, but it is clear that its purpose is to compromise systems and steal their resources.

The malware's capabilities include resource-hijacking and persistence, allowing it to maintain itself on infected systems even after initial access has been revoked. It does not appear to be linked to any specific threat actor types or tool types.",malware--9a34bbdf-cba5-4f1c-d9ca-cfac9978bf65,malware
"The object contains information about a type of malware known as Proxyware. It is used to monetize compromised servers by sharing their internet bandwidth with external parties, often without the owner's consent. Additionally, Proxyware is classified as family and belongs to the category of malware. Specifically, it falls under the types of malware that include trojans and adware.

Furthermore, this malware type is known for its ability to hijack resources and facilitate data exfiltration. It primarily serves the purpose of sharing bandwidth with external parties without the owner's consent. The sophistication level of this malware type is unknown, but it has been identified as a threat actor type that falls under certain categories.",malware--6d7e76f7-4c18-e535-67a4-48e11ebb2498,malware
"The object contains information about the Gh0st RAT malware, a type of remote-access Trojan that allows attackers to gain persistent control over infected systems. The malware is designed to provide attackers with the means to steal data and enable further exploitation. It is classified as a backdoor and a remote-access Trojan.

Gh0st RAT was installed to facilitate persistent remote access and control over compromised systems, enabling malicious actors to exploit the systems for their own purposes. The malware's capabilities include remote access, command-and-control operations, and data exfiltration.",malware--4d1f1382-6a78-92b1-e655-da01495302a0,malware
"The object contains information about a type of malware called Cobalt Strike. This malware is frequently abused by attackers to establish command-and-control channels, allowing for lateral movement within networks. The tool's purpose is to facilitate this type of activity. Cobalt Strike is classified as a backdoor and remote-access Trojan, indicating that it provides unauthorized access to systems.",malware--d10440fb-0e62-3537-56f5-aa7e3d3d443f,malware
"The object contains a detailed description of the Meterpreter malware, which is a type of backdoor and remote-access Trojan that allows attackers to control compromised systems and execute further malicious actions. The primary purpose of this payload is for post-exploitation, enabling attackers to remotely access and manipulate infected systems.

Meterpreter has specific capabilities such as remote access, command-and-control, and lateral movement, which are essential features for maintaining control over a compromised system. Additionally, it can be used to execute malicious actions on the affected system.

The malware has been categorized under two primary types: backdoor and remote-access Trojan. This classification highlights its ability to provide unauthorized access to systems and facilitate communication between attackers and infected systems.

In terms of sophistication, Meterpreter is considered a moderately sophisticated tool, indicating that it requires some level of expertise to utilize effectively. However, the specific metrics used to evaluate this aspect are not provided in the given data.

Meterpreter was developed with several features in mind, including remote access, command-and-control, and lateral movement capabilities. These features enable attackers to gain control over a system, execute malicious actions, and move laterally within the network.

The primary motivation behind Meterpreter is not explicitly stated in the given data. However, its purpose as a payload for post-exploitation suggests that its primary motivation is to facilitate the execution of further malicious actions on compromised systems.",malware--2b0ea882-cf9c-918a-9610-d71354fe5166,malware
"The object contains information about the Trigona ransomware, a type of malicious software that targets exposed MS-SQL servers. The malware's primary goal is to encrypt files and demand ransom payments from victims after gaining access via brute force or credential attacks.

The Trigona ransomware falls under the category of family malware, indicating that it is part of a larger group of similar threats. Its sophistication level is not specified in the provided data.

The ransomware's capabilities include encryption, data exfiltration, and persistence. These features enable the malware to effectively lock down victim systems, steal sensitive information, and maintain its presence over time.

The Trigona ransomware is classified as a type of ransomware, which is a specific category of malware designed to extort money from victims by encrypting their files or data. The primary motivation behind this malware's development is likely financial gain through ransom payments.

Overall, the Trigona ransomware represents a significant threat to organizations with exposed MS-SQL servers, as it can compromise sensitive information and disrupt critical operations.",malware--91cab5f4-544b-ad15-1b29-b7a4c0117368,malware
"The object contains information about a type of malware known as Teramind. It is described as typically being used by attackers to remotely monitor and control infected systems, allowing for ongoing surveillance and access. The malware falls under the category of spyware and remote-access Trojan.

Teramind's primary function in this context appears to be facilitating remote access, with capabilities including persistence, data-exfiltration, and other malicious activities. Its sophistication level is currently unknown, but it is stated that its primary motivation for use by attackers is unclear.

It's worth noting that while Teramind is typically a legitimate Remote Monitoring Management (RMM) tool, attackers have been known to abuse this software for their own nefarious purposes.",malware--078e9bc0-8552-0b5a-7e45-7bb0763e6a67,malware
"The object contains information about the malware known as AnyDesk. The primary purpose of this malware is to establish persistent remote access to compromised servers, which is carried out using a legitimate remote desktop application called AnyDesk that has been hijacked by attackers.

AnyDesk is used maliciously to provide unauthorized access to systems, allowing attackers to maintain control over them even after the initial infection has been removed. This type of attack relies on the misappropriation of a widely available and trusted tool to achieve its objectives.

The malware in question falls under the category of remote-access trojans, which are designed to enable malicious actors to gain remote access to compromised systems.",malware--d3ec00d1-2fc8-e67d-8022-63dc9e85639a,malware
"The object contains information about a type of malware, specifically a custom Rust-based scanner. This scanner is designed to enumerate and brute-force RDP and MS-SQL services, collecting system and geolocation data for further exploitation.

It's worth noting that this malware has the potential to be used in various malicious activities, including data exfiltration, credential theft, and lateral movement. The primary function of the scanner is to collect information about the target system, which can then be used to gain access to it or to spread laterally within an organization.

The scanner falls under a specific category of malware, classified as both a ""scanner"" and a ""trojan."" This classification suggests that the malware's purpose is primarily related to scanning and reconnaissance, although its ability to impersonate itself as a legitimate system process also makes it a Trojan in disguise.",malware--bc45f322-47f3-aaa4-52f6-6eb22e13c63b,malware
"The object contains information about a malware named StressTester. It is written in Go programming language and is used to test internet speed, perform SQL injection requests, and aid attackers in identifying vulnerable systems and services. The malware falls under the category of ""scanner"" and ""trojan"", indicating its malicious nature.

StressTester has specific goals related to data exfiltration and lateral movement, which are capabilities that enable it to operate within a network system. This suggests that StressTester can potentially be used by attackers to steal sensitive information or move laterally across the network.

The malware also belongs to the family of ""scanner"" and ""trojan"" types, indicating its classification as a malicious tool designed to aid in identifying vulnerable systems and services. Its primary motivation is unclear from the provided data, but it can be inferred that its purpose is related to facilitating the exploitation of vulnerabilities for malicious activities.

Overall, StressTester appears to be a sophisticated malware with capabilities that enable it to operate within a network system and potentially cause harm to individuals or organizations.",malware--77905037-613d-72b0-2fd2-70e72bfa8b56,malware
