aliases,created,created_by_ref,description,external_references,goals,id,identity_class,is_family,kill_chain_phases,malware_types,modified,name,primary_motivation,sophistication,spec_version,threat_actor_types,tool_types,type,x_capabilities
,2026-01-16T09:31:18.941038Z,,Socket is the publisher of this threat intelligence report. STIXed by TI Mindmap HUB.,,,identity--61f25293-60ae-c54f-5dc9-804b842cf3fa,organization,,,,2026-01-16T09:31:18.941038Z,Socket,,,2.1,,,identity,
,2026-01-16T09:31:18.941038Z,,TI Mindmap HUB is an AI-powered threat intelligence platform that generates STIX bundles from OSINT sources.,,,identity--fbd192cb-0ab2-33e3-92cc-c2456bf8d439,organization,,,,2026-01-16T09:31:18.941038Z,TI Mindmap HUB,,,2.1,,,identity,
,2026-01-16T09:31:51.501152Z,identity--61f25293-60ae-c54f-5dc9-804b842cf3fa,"Attackers publish Chrome extensions that masquerade as productivity or security tools for enterprise HR and ERP platforms such as Workday, NetSuite, and SuccessFactors. These extensions are distributed via the Chrome Web Store and marketed to users and administrators as legitimate tools for account management and workflow optimization. The extensions request standard permissions that do not appear suspicious during installation, and their privacy policies falsely claim not to collect user data. This social engineering approach enables attackers to gain initial access to enterprise environments by convincing users to install the extensions, thereby granting the malicious code the necessary permissions to operate within the browser context.","[{""source_name"": ""mitre-attack"", ""url"": ""https://attack.mitre.org/techniques/T1195/002/"", ""external_id"": ""T1195.002""}]",,attack-pattern--72e780e3-d65e-dec7-488f-fbeab940e5d0,,,"[{""kill_chain_name"": ""mitre-attack"", ""phase_name"": ""initial-access""}]",,2026-01-16T09:31:51.501152Z,Malicious Chrome Extension Deployment for Initial Access,,,2.1,,,attack-pattern,
,2026-01-16T09:31:51.501352Z,identity--61f25293-60ae-c54f-5dc9-804b842cf3fa,"Several extensions, including DataByCloud Access, Data By Cloud 1, and Software Access, implement automated extraction of authentication cookies—specifically targeting cookies named '__session' used for authentication in HR and ERP platforms. The extensions use Chrome's cookie APIs to retrieve all cookies for targeted domains, filter for authentication tokens, and exfiltrate them to attacker-controlled remote servers (e.g., api.databycloud.com or api.software-access.com) every 60 seconds. This persistent monitoring and exfiltration enables attackers to collect valid session tokens for enterprise accounts, facilitating unauthorized access and account takeover.","[{""source_name"": ""mitre-attack"", ""url"": ""https://attack.mitre.org/techniques/T1539/"", ""external_id"": ""T1539""}]",,attack-pattern--26794465-ddf4-6cd8-ea88-4df73eced529,,,"[{""kill_chain_name"": ""mitre-attack"", ""phase_name"": ""credential-access""}]",,2026-01-16T09:31:51.501352Z,Session Cookie Theft and Exfiltration,,,2.1,,,attack-pattern,
,2026-01-16T09:31:51.501457Z,identity--61f25293-60ae-c54f-5dc9-804b842cf3fa,"Extensions such as Tool Access 11 and Data By Cloud 2 actively interfere with enterprise platform security by manipulating the Document Object Model (DOM) of targeted web pages. They erase content and redirect users away from up to 56 critical administrative and incident response pages, including those for password changes, account deactivation, 2FA device management, and audit log access. This prevents legitimate users and security teams from accessing security controls, managing authentication, or responding to incidents, effectively crippling the ability to detect and remediate account compromise.",,,attack-pattern--129292d4-a5be-d41b-aeb9-c2445842e452,,,"[{""kill_chain_name"": ""mitre-attack"", ""phase_name"": ""defense-evasion""}]",,2026-01-16T09:31:51.501457Z,DOM Manipulation to Block Security Administration Pages,,,2.1,,,attack-pattern,
,2026-01-16T09:31:51.501545Z,identity--61f25293-60ae-c54f-5dc9-804b842cf3fa,"The Software Access extension implements a sophisticated session hijacking technique by not only exfiltrating session cookies to its command and control server but also receiving stolen cookies from the server. Using the chrome.cookies.set() API, the extension injects these cookies into the browser, enabling attackers to assume the session of any targeted account directly within the victim's browser. This bidirectional manipulation allows for seamless account takeover and persistent unauthorized access, bypassing traditional authentication mechanisms.",,,attack-pattern--55f6a4c6-469c-a2e1-db56-6452d72070df,,,"[{""kill_chain_name"": ""mitre-attack"", ""phase_name"": ""privilege-escalation""}]",,2026-01-16T09:31:51.501545Z,Bidirectional Session Cookie Injection for Direct Session Hijacking,,,2.1,,,attack-pattern,
,2026-01-16T09:31:51.501626Z,identity--61f25293-60ae-c54f-5dc9-804b842cf3fa,"Data By Cloud 1 incorporates the DisableDevtool library to actively block access to browser developer tools. By preventing users and security analysts from inspecting the extension's code or monitoring its behavior through developer tools, the attackers increase the difficulty of detection and analysis. This technique helps maintain the stealth of malicious activities such as cookie theft and DOM manipulation, prolonging the extension's presence in the victim environment.",,,attack-pattern--8045fc1e-fcc6-9eaa-b70c-6059df476dea,,,"[{""kill_chain_name"": ""mitre-attack"", ""phase_name"": ""defense-evasion""}]",,2026-01-16T09:31:51.501626Z,Blocking Browser Developer Tools to Prevent Code Inspection,,,2.1,,,attack-pattern,
,2026-01-16T09:31:51.501704Z,identity--61f25293-60ae-c54f-5dc9-804b842cf3fa,"The Software Access extension includes mechanisms to protect password input fields from inspection. This prevents users and analysts from viewing or extracting credentials entered into the browser, further complicating incident response and forensic analysis. By obfuscating or blocking access to password fields, the attackers reduce the likelihood of their credential theft activities being discovered or interrupted.",,,attack-pattern--ee586b17-fa3e-feb5-b8c1-fefed885cf08,,,"[{""kill_chain_name"": ""mitre-attack"", ""phase_name"": ""defense-evasion""}]",,2026-01-16T09:31:51.501704Z,Password Field Protection to Prevent Credential Inspection,,,2.1,,,attack-pattern,
,2026-01-16T09:31:51.501783Z,identity--61f25293-60ae-c54f-5dc9-804b842cf3fa,"Extensions maintain continuous surveillance of the authentication state by periodically extracting session tokens and monitoring user activity on enterprise platforms. This persistent monitoring ensures that attackers receive up-to-date credentials and can maintain access even as authentication tokens change or sessions are refreshed. The extensions' background scripts automate this process, enabling long-term compromise and facilitating ongoing account hijacking.",,,attack-pattern--367a02bd-1374-fd4b-69c6-2da25aae35ee,,,"[{""kill_chain_name"": ""mitre-attack"", ""phase_name"": ""persistence""}]",,2026-01-16T09:31:51.501783Z,Persistent Monitoring of Authentication State,,,2.1,,,attack-pattern,
,2026-01-16T09:31:51.501835Z,identity--61f25293-60ae-c54f-5dc9-804b842cf3fa,"The extensions encrypt traffic sent to their command and control servers when exfiltrating session tokens and authentication cookies. This encryption helps evade network-based detection mechanisms and makes it more difficult for defenders to identify or analyze the stolen data in transit. By securing the exfiltration channel, attackers increase the success rate of credential theft and reduce the risk of interception by enterprise security tools.","[{""source_name"": ""mitre-attack"", ""url"": ""https://attack.mitre.org/techniques/T1041/"", ""external_id"": ""T1041""}]",,attack-pattern--1a318bb6-79b6-0366-00e5-26086e2476c0,,,"[{""kill_chain_name"": ""mitre-attack"", ""phase_name"": ""exfiltration""}]",,2026-01-16T09:31:51.501835Z,Encrypted Command and Control Traffic for Cookie Exfiltration,,,2.1,,,attack-pattern,
"[""DataByCloud Access"", ""Data By Cloud 1"", ""Data By Cloud 2""]",2026-01-16T09:31:59.840038Z,identity--61f25293-60ae-c54f-5dc9-804b842cf3fa,"DataByCloud is a family of malicious Chrome extensions masquerading as productivity tools for enterprise HR and ERP systems. They steal authentication cookies, block access to security administration pages, and interfere with incident response, enabling session hijacking and account takeover.",,,malware--d155005c-19f8-0f62-9c02-92a4f6d5a6ae,,True,,"[""trojan"", ""spyware""]",2026-01-16T09:31:59.840038Z,DataByCloud,,,2.1,,,malware,"[""data-exfiltration"", ""credential-theft"", ""anti-analysis"", ""persistence""]"
,2026-01-16T09:31:59.840125Z,identity--61f25293-60ae-c54f-5dc9-804b842cf3fa,"Tool Access 11 is a Chrome extension that blocks access to administrative and security pages within enterprise platforms, preventing users from managing authentication and incident response settings. It is used to disrupt security controls and facilitate unauthorized access.",,,malware--d6221321-4616-d56c-09ff-58caa4752e6d,,True,,"[""trojan"", ""spyware""]",2026-01-16T09:31:59.840125Z,Tool Access 11,,,2.1,,,malware,"[""anti-analysis"", ""persistence""]"
,2026-01-16T09:31:59.840180Z,identity--61f25293-60ae-c54f-5dc9-804b842cf3fa,Software Access is a malicious Chrome extension that exfiltrates authentication tokens and injects stolen cookies to enable direct session hijacking. It also implements protections against inspection of credential inputs and shares infrastructure patterns with DataByCloud extensions.,,,malware--569cc7cd-dbdb-9d55-af0e-5ed49262f206,,True,,"[""trojan"", ""spyware""]",2026-01-16T09:31:59.840180Z,Software Access,,,2.1,,,malware,"[""data-exfiltration"", ""credential-theft"", ""remote-access"", ""anti-analysis"", ""persistence""]"
"[""DataByCloud"", ""DataByCloud Access"", ""Data By Cloud 1"", ""Data By Cloud 2"", ""Tool Access 11""]",2026-01-16T09:32:06.016876Z,identity--61f25293-60ae-c54f-5dc9-804b842cf3fa,"The publisher 'databycloud1104' is responsible for four of the malicious Chrome extensions targeting enterprise HR and ERP platforms. These extensions work together to steal authentication tokens, block incident response capabilities, and enable account takeover through session hijacking.",,"[""Steal authentication tokens"", ""Block incident response and security controls"", ""Enable complete account takeover via session hijacking""]",threat-actor--113be3c2-c7df-98fe-0ffb-f1afeea191e2,,,,,2026-01-16T09:32:06.016876Z,databycloud1104,financial,advanced,2.1,"[""unknown""]",,threat-actor,
"[""Software Access""]",2026-01-16T09:32:06.016970Z,identity--61f25293-60ae-c54f-5dc9-804b842cf3fa,"The publisher 'softwareaccess' operates the fifth malicious Chrome extension, sharing identical infrastructure and attack patterns with the databycloud1104 group. This extension exfiltrates authentication tokens and enables direct session hijacking through bidirectional cookie injection.",,"[""Steal authentication tokens"", ""Enable direct session hijacking"", ""Bypass security controls and incident response""]",threat-actor--88a3b19d-6549-2c28-a5c6-d0a8df2a47d7,,,,,2026-01-16T09:32:06.016970Z,softwareaccess,financial,advanced,2.1,"[""unknown""]",,threat-actor,
,2026-01-16T09:32:13.521300Z,identity--61f25293-60ae-c54f-5dc9-804b842cf3fa,"The malicious extensions abuse the legitimate Chrome Extension API, specifically the chrome.cookies module, to programmatically access, extract, and inject authentication cookies for enterprise HR and ERP platforms, enabling session hijacking and credential theft.",,,tool--fcbcabb8-a0bf-b367-b2cb-e40dc2c4355b,,,"[{""kill_chain_name"": ""mitre-attack"", ""phase_name"": ""credential-access""}]",,2026-01-16T09:32:13.521300Z,Chrome Extension API (chrome.cookies),,,2.1,,"[""credential-exploitation"", ""information-gathering""]",tool,
,2026-01-16T09:32:13.521561Z,identity--61f25293-60ae-c54f-5dc9-804b842cf3fa,"The extensions use the chrome.cookies.set() function to inject stolen authentication cookies into the browser, allowing attackers to hijack sessions by impersonating legitimate users on targeted platforms.",,,tool--a13e2556-405b-6abb-3f6d-2dd2edf6ed56,,,"[{""kill_chain_name"": ""mitre-attack"", ""phase_name"": ""lateral-movement""}]",,2026-01-16T09:32:13.521561Z,Chrome Extension API (chrome.cookies.set),,,2.1,,"[""credential-exploitation""]",tool,
,2026-01-16T09:32:13.524604Z,identity--61f25293-60ae-c54f-5dc9-804b842cf3fa,"The extensions leverage chrome.cookies.getAll to enumerate and extract all cookies for specified domains, filtering for authentication tokens to exfiltrate to attacker-controlled infrastructure.",,,tool--6b9ab10b-a0d6-c163-5e7c-cf86e6265bff,,,"[{""kill_chain_name"": ""mitre-attack"", ""phase_name"": ""collection""}]",,2026-01-16T09:32:13.524604Z,Chrome Extension API (chrome.cookies.getAll),,,2.1,,"[""credential-exploitation"", ""information-gathering""]",tool,
,2026-01-16T09:32:13.524991Z,identity--61f25293-60ae-c54f-5dc9-804b842cf3fa,"The extensions request and abuse standard Chrome extension permissions such as scripting, management, declarativeNetRequest, and storage to manipulate web pages, block access to security administration interfaces, and maintain persistence.",,,tool--ec28c7f9-820c-3114-53db-b73751c830b9,,,"[{""kill_chain_name"": ""mitre-attack"", ""phase_name"": ""defense-evasion""}]",,2026-01-16T09:32:13.524991Z,"Chrome Extension API (chrome.scripting, chrome.management, chrome.declarativeNetRequest, chrome.storage)",,,2.1,,"[""defense-evasion"", ""information-gathering""]",tool,
,2026-01-16T09:32:13.525255Z,identity--61f25293-60ae-c54f-5dc9-804b842cf3fa,"The DisableDevtool library is used to prevent users and security analysts from inspecting or debugging the extension code via browser developer tools, hindering incident response and analysis.",,,tool--7c621e82-f5ee-60be-6bd1-c6715414cfb0,,,"[{""kill_chain_name"": ""mitre-attack"", ""phase_name"": ""defense-evasion""}]",,2026-01-16T09:32:13.525255Z,DisableDevtool Library,,,2.1,,"[""defense-evasion""]",tool,
